,Text,Date,Retweets,Favorites,Mentions,HashTags
218,"Prepare for another lockdown. They need another one to completely destroy our economy, take more of our freedoms &amp; further their tyrannical plans. Normal flu season is coming, they will use this to increase fear when the elderly &amp; infirm die as, sadly, has always been the case.",2020-08-09 17:54:58+00:00,203,574,,
219,Looking forward to being part of this! they don’t lockdown London before then! ,2020-08-09 17:50:59+00:00,38,62,,
220,"40 official meals since lockdown. From burning water to amateur cook, MAMA I MADE IT! Give the page a follow if you like food.Counting down to a month long scoff fest so I’m taking it easy on the cooking now but I may try to reach the 50 meal mark so stay tuned ",2020-08-09 17:48:02+00:00,13,71,,
221,Many congrats to @andysulligolf on his victory today @HanburyManor on @EuropeanTour . Andy became an honorary member with us in 2016 and became our attached Tour Pro during lockdown. Proud to have you representing us. Classy from start to finish ... ,2020-08-09 17:47:37+00:00,15,236,@andysulligolf @HanburyManor @EuropeanTour,
222,"The mental health issues related to our lockdown and the pandemic are especially hard for people with depression. NAMI, The National Alliance on Mental Health has a 24 hour helpline: 1-800-950-6264.",2020-08-09 17:47:26+00:00,11,35,,
223,Suspect a few piss takers have infiltrated Toby Young's excruciating 'lockdown sceptics' dating forum ,2020-08-09 17:47:21+00:00,10,65,,
224,Someone from Yorkshire in London and they are black. Call the police. Someone from London in Durham in Lockdown and they are white. Nothing to see here. #NotmovingontilDomisgone,2020-08-09 17:46:39+00:00,17,78,,#NotmovingontilDomisgone
225,"Before quarantine, I wanted to become a doctor.But the student inside me has died in this lockdown. I want to quit my studies now. Bs inter hi bht hai!",2020-08-09 17:43:17+00:00,3,42,,
226,Some people are gingerly coming out of Covid lockdown and going on holiday. What’s the first thing TERFs do?... Why sticker the town they’re staying in with transphobic stickers of course! Yet another sign they’re obsessive extremists. ,2020-08-09 17:43:16+00:00,16,56,,
227,Given what we have learned during a horrendous 6 months about the age-discrimination of #COVID19 - it is time for a rethink of #lockdown and time for us all to consider giving young people back their freedom. ,2020-08-09 17:41:25+00:00,10,39,,#COVID19 #lockdown
228,"If this lockdown continues more and more, at some point we just gone have to ultimately rebel because the opening and closing repeatedly don’t make no sense.",2020-08-09 17:36:42+00:00,72,166,,
229,Can we keep having Zoom Meetings even after lockdown...PLEASE. No unnecessary drives to meetings anymore,2020-08-09 17:36:10+00:00,10,48,,
230,Insert 10 emojis you've recently used to see if you are happy or life ke Lockdown ....,2020-08-09 17:32:21+00:00,17,30,,
231,"Attention citizens! Your Dept. Of Pandemia and Amazon announce Lockdown Prime (TM). Members enjoy free train transport to Hygenic Communities (please don’t call them camps), where all member needs will be met. Bezos makes free. Two-day shipping also included. Attention citizens!",2020-08-09 17:30:06+00:00,133,648,,
232,ICYMI: The Federal Government expended about N523.3 million on school feeding programme during the lockdown against the coronavirus pandemic https://buff.ly/2DE8SZU,2020-08-09 17:29:38+00:00,21,60,,
233,"Are cars from North Yorkshire not allowed into London? If the police are this hot on “out of town cars”, it makes you wonder how Cummings made it up north at the height of lockdown without being stopped ",2020-08-09 17:25:35+00:00,50,150,,
234,We return to the airwaves tomorrow with the latest on the #migrant scandal from @TiceRichard and the #coronavirus lockdown with @ClarkeMicah - tune in from 10am,2020-08-09 17:25:20+00:00,74,267,@TiceRichard @ClarkeMicah,#migrant #coronavirus
235,"Here is the case profile per 100,000 popl for the 3 lockdown counties based on NPHET data up to 07/08. There could be a case for Laois to exit lockdown early if the current downward trend continues. Peak infection 2nd of Aug. No overwhelming logic to link to other two counties. ",2020-08-09 17:25:16+00:00,14,76,,
236,How come they stop Dawn but somehow neglected to stop Cummings DURING LockDown?,2020-08-09 17:22:06+00:00,21,140,,
237,"New idea: the lockdown lovers can lock themselves down. Four weeks, six weeks, whatevs. The rest of us will stay unlocked.",2020-08-09 17:21:27+00:00,3619,16198,,
238,"Wild hair thanks to the bike helmet & a decent breeze. A wee pedal to Rogie Falls & Loch na Crann with a delicious treat - feels like a holiday, left no trace. Non alcoholic G&T (Seedlip & Schweppes) has been one of our best lockdown discoveries. ",2020-08-09 17:19:08+00:00,8,85,,
239,"Calling for preemptive lockdown for the 2nd wave even though the 1st lockdown never ended! Increased lockdown will not save the economy, it will finish it off. Mason by name.. ",2020-08-09 17:18:27+00:00,17,48,,
240,Happy Sunday we had a wonderful time visiting family today for the first time since lockdown so precious #follow #ZSHQ #puppy #Zombiebullz #WeTheNorth #pedegree #dog #puppies #HereWeGo #NYYankees #Ruffriderz #puppybulldog #TJ5,2020-08-09 17:16:50+00:00,10,112,,#follow #ZSHQ #puppy #Zombiebullz #WeTheNorth #WeTheNorth #pedegree #dog #puppies #HereWeGo #NYYankees #Ruffriderz #puppybulldog #TJ5
241,Religious liberty is being attacked by the left like never before. Not only has Americans’ God-given right to worship been disregarded during this lockdown... We can’t even disagree on certain social issues without fearing retribution. We must defend religious liberty! ,2020-08-09 17:16:22+00:00,40,87,,
242,Immunity not transmission determines mortality. There is absolutely no correlation between lockdown measures and mortality,2020-08-09 17:15:55+00:00,20,125,,
243,Lockdown supporters cannot bear the thought that Sweden has got it right ,2020-08-09 17:14:31+00:00,33,55,,
244,I just want to say my heart goes out to all of you who are struggling through this lockdown. My life is easy compared to what many of you are enduring. I continue to pray that America can overcome. God bless all who are suffering on this Sunday.,2020-08-09 17:11:33+00:00,2183,9745,,
245,"PM @narendramodi said govt has transferred Rs 75,000 crore to farmers under #PMKisanYojana in last one-and-a-half years, of which Rs 22,000 crore was remitted during #lockdown period ",2020-08-09 17:10:00+00:00,14,116,@narendramodi,#PMKisanYojana #lockdown
246,'A total of 743 employees of Tirumala Tirupati Devasthanams (TTD) tested positive for COVID-19 after the temple was opened for darshan to devotees following relaxation of lockdown norms' ,2020-08-09 17:08:52+00:00,1650,4336,,
247,"System up with the top down, got the city on lockdown #Blue #SchnauzerGang #ZSHQ",2020-08-09 17:07:06+00:00,9,109,,#Blue #SchnauzerGang #ZSHQ
248,If Lockdown Is To Be Over Then Please #ReopenMedicalColleges Aswel.,2020-08-09 17:05:20+00:00,20,51,,#ReopenMedicalColleges
249,I thought beaches were closed. Why are foreign boaters still allowed on beaches? Do these lockdown orders not apply to them? I’m confused.,2020-08-09 17:04:58+00:00,5,29,,
250,People work longer and different hours under lockdown ,2020-08-09 17:03:38+00:00,7,20,,
251,Nine years of war and several months of COVID-19 lockdown has not taken away their positive outlook on life. These Syrian refugees have a message to share. ,2020-08-09 17:02:00+00:00,38,96,,
252,Super-rich families are buying multiple citizenships to prepare for the next lockdown. Here's how citizenship-by-investment programs work and why they're getting more popular. ,2020-08-09 17:01:03+00:00,76,126,,
253,"State-sponsored #COVID19 TERRORISM: L.A. threatens to cut off electricity &amp; water of private homes that refuse to comply with authoritarian lockdown rules. PRESIDENT Signs Executive Order: Payroll Tax Holiday, Enhanced Unemployment Checks PELOSI STUNNED ",2020-08-09 16:58:15+00:00,21,38,,#COVID19
254,"Respect goes to Marina Granovskaia, who didn’t fall for the pressure of Willian & his agent. They can go and do as many interviews as they want, also claimed to be unauthorised ones during lockdown to put pressure on the club but she didn’t fall for it at all. We move on!!#CFC",2020-08-09 16:57:44+00:00,106,1559,,#CFC
255,"As for Chelsea, Lampard has really shit the bed post lockdown. He went from having a reliable pattern of breaking down low blocks, compactness in transition, good approaches in big games and being unlucky to being so far behind in the league to overly fluid, naive football.",2020-08-09 16:55:07+00:00,6,70,,
256,"People getting annoyed about a local lockdown are, like you, under a false impression that it's simple to prevent meat factory outbreaks. And yet the evidence is almost no country with a meat industry has managed to avoid meat plant clusters.",2020-08-09 16:54:25+00:00,6,77,,
257,Namibia was on full lockdown with 2 cases. Now it’s just vibes ,2020-08-09 16:53:18+00:00,89,384,,
258,"In The Spectator. Lionel Shriver writes Covic Deaths stand at 46.000 ??? Hong Kong Flu of 1968/69 killed 80.000 Britons. No lockdown, no masks, no social distancing, back then. COVIC is unpredented: never has a virus been so oversold”. NO wonder BJ doesn’t want a full enquiry.",2020-08-09 16:52:50+00:00,74,153,,
259,New Zealand got rid of the virus by imposing a strict lockdown in late March when only about 100 people had tested positive for the disease. That stopped its spread ,2020-08-09 16:52:21+00:00,232,819,,
260,Spoke on the need of resuming the economic activities as many people are suffering due to continued #lockdown . We need a systematic #unlock plan while fighting #coronavirus #pandemic .,2020-08-09 16:52:10+00:00,40,306,,#lockdown #unlock #coronavirus #pandemic
261,I have been in Tembisa today. Fuckall COVID 19 going on there. It is scary to see how many people does not wear masks. I was made to believe that that it was exactly how it was during lockdown too! ,2020-08-09 16:51:17+00:00,40,97,,
262,Don't agree with our PM on the endless Lockdown but UKGov's bail-out of business &amp; jobs was welcome. As is his showing faith in Scotland as a tourist destination for English folk. Hope you will promote this @VisitScotland ! Quite the reverse of #SNP saying F-Off to visitors.,2020-08-09 16:47:27+00:00,23,56,@VisitScotland,#SNP
263,"A missed Celtic during lockdown etc but this can’t be good for your health If we don’t get a win that’s my whole week ruined, that’s how my life works ",2020-08-09 16:44:49+00:00,13,331,,
264,Evening all. Just to let you know im recording an interview with bbc5live tomorrow. The content will be concerning a @MencapCymru recent survey on the catastrohic effect lockdown has had on disabled people and their carers. Hoping to get on channel 4 too.,2020-08-09 16:44:22+00:00,31,103,@MencapCymru,
265,Name something a terrible 2 year old refuses to do? Why do these answers look like lockdown instructions??? #FamilyFeudSA @KFCSA,2020-08-09 16:42:00+00:00,25,150,@KFCSA,#FamilyFeudSA
266,"@NCDCgov where is social distancing during this funeral? Please call off this lockdown or simply allow event centers to open, since April, no business. I'm married with a 4 yrs old daughter, please, we can live with this virus just like others HIV, Ebola, SARS ....",2020-08-09 16:40:16+00:00,13,69,@NCDCgov,
267,A US Citizen Is Among 44 Tablighi Activists Of Foreign Origin Who Chose To Face Trial Ali is not accepting that he has violated visa rules & COVID regulations as he had left the Markaz Tablighi Jamaat well before the announcement of lockdown on March 24. ,2020-08-09 16:36:50+00:00,101,172,,
268,Is anyone emotionally prepared for the inevitable COVID-19 lockdown when everything goes to hell this fall?,2020-08-09 16:35:05+00:00,9,172,,
269,"Official SAGE minutes show lockdown caused MORE deaths from cancer and heart disease, than people who died from Covid. Boris must fire the CMO and his cronies without further delay. ",2020-08-09 16:33:50+00:00,47,61,,
270,Baked Bean received emergency treatment during #lockdown at PDSA Bradford &amp; was diagnosed with a chest infection She was prescribed antibiotics &amp; is now recovering thanks to our vets Please donate so we can help more pets like Baked Bean: https://bit.ly/3kagtQm #PDSAPets,2020-08-09 16:32:04+00:00,21,128,,#lockdown #PDSAPets
271,"Indian armys ik we all have fcked up sleeping schedules coz of the lockdown But please note that the single is releasing at ""9:30 AM"" on august 21 which means we gotta wake up early Please don't say I'm gonna stay up the previous night...",2020-08-09 16:30:52+00:00,762,2668,,
272,"For those celebrating #BookLoversDay today, my humble contribution this year to your reading pleasure is not one but two books (the first delayed by the #Lockdown hiatus in publishing): #Tharoorosaurus (Penguin) in Sept &amp; #TheBattleOfBelonging (Aleph), on nationalism, in November",2020-08-09 16:28:45+00:00,227,1949,,#BookLoversDay #Lockdown #Tharoorosaurus #TheBattleOfBelonging
273,"There’s one country that the ""public health experts"" don’t seem to want to talk about - Sweden. Sweden debunks the hysteria. Sweden shows how unnecessary all of the interventions to “fight” the virus are. Sweden exposes the lockdown and mask madness. ",2020-08-09 16:27:24+00:00,403,696,,
274,"Up to 81% have T-cell immunity, 70% are asymptomatic, herd immunity when 10-20% have antibodies (e.g. NYC), and #COVID is expected to burn out in a few weeks... But, let’s #lockdown, wear masks and wait 6 months for a vaccine that is 50% effective... ",2020-08-09 16:27:14+00:00,3210,5483,,#COVID #lockdown
275,"Time to replenish the Mother #Earth: Humble appeal to one and all to plant a sapling. During the #Covid19 Lockdown, the sky has become more clear, the rivers are cleaner, the air is fresh. Let us all learn to respect the Nature. @BJP4India @narendramodi @JPNadda @PrakashJavdekar",2020-08-09 16:24:19+00:00,126,96,@BJP4India @narendramodi @JPNadda @PrakashJavdekar,#Earth #Covid19
276,BREAKING: Sheffield sent into lockdown while Anthony McGill walks to The Crucible to avoid anyone getting in his eyeline.,2020-08-09 16:23:30+00:00,19,167,,
277,Lockdown - Day 2 @Justy_FishHook,2020-08-09 16:20:48+00:00,17,162,@Justy_FishHook,
278,Scots landlords served hundreds of eviction notices during lockdown ,2020-08-09 16:19:33+00:00,37,32,,
279,"While a global lockdown quiets the ocean and lures New Zealand’s biggest great whites out of hiding, expert Kina Scollay is on a quest to find monster shark 747. #SharkLockdown is on TONIGHT at 10p on @Discovery. #SharkWeek",2020-08-09 16:17:53+00:00,38,169,@Discovery,#SharkLockdown #SharkWeek
280,Real Husbands and Wives of #BBNaija lockdown ,2020-08-09 16:16:35+00:00,27,244,,#BBNaija
281,"MAJOR: Germany Awakens as Half-a-Million March Against Covid-19 Lockdown, Masks, Distancing @FortRussNews https://fort-russ.com/2020/08/major-germany-awakens-as-half-a-million-march-against-covid-19-lockdown-masks-distancing/",2020-08-09 16:16:20+00:00,10,25,@FortRussNews,
282,"We officially lift the lockdown of Bagong Kaunlaran Compound in Paso de Blas. They have completed the 14 days mandatory quarantine period. Salamat sa mga Barangay officials natin led by Kap. Lucy, police, rescue and health workers who stayed close to the compound.",2020-08-09 16:15:37+00:00,23,290,,
283,"Max and Stacy will be live with a LOCKDOWN WITH THE KEISERS at 1pm EDT at https://www.youtube.com/maxkeisertv! In the meantime, we are making titles for @orangepillpod which premieres next week! @maxkeiser @stacyherbert",2020-08-09 16:13:48+00:00,29,192,@orangepillpod @maxkeiser @stacyherbert,
284,first day of lockdown till now https://twitter.com/fredtv_/status/1292493796542943239,2020-08-09 16:13:27+00:00,18,334,,
285,"""Direct COVID deaths account for the majority of all excess deaths. However, when morbidity is taken into account, the estimates for the health impacts from a lockdown/lockdown induced recession are greater in terms of QALYs than the direct COVID deaths."" ",2020-08-09 16:12:00+00:00,92,193,,
286,"Here’s how to crush the virus until vaccines arrive, to save both lives and the economy — A more restrictive lockdown, state by state, for up to 6 weeks, or we’ll continue to allow the coronavirus to spread rapidly throughout the U.S. ",2020-08-09 16:10:42+00:00,52,62,,
287,"Excl: Home Office spends more than £1m deporting hundreds of people at height of lockdown, figures show Nearly 300 individuals, escorted by 374 immigration officers, removed from UK in Apr/May/June despite govt instructing against all non-essential travel ",2020-08-09 16:09:29+00:00,149,119,,
288,Most of the posts on Toby Young's Anti lockdown dating section are piss takes. https://twitter.com/toadmeister/status/1292442749518647296,2020-08-09 16:08:34+00:00,202,636,,
289,One good thing about the lockdown has been that I realized how much I actually love reading books. I always thought of it to be boring but I've read 7 books in 2 months and now there's no turning back Words have made me feel emotions that pictures never did #BookLoversDay,2020-08-09 16:08:24+00:00,12,84,,#BookLoversDay
290,"Even during lockdown, food workers still showed up to work... and were often underpaid, undervalued and at high risk of contracting #COVID19. Advocates are taking a stand. Read more ",2020-08-09 16:06:00+00:00,17,24,,#COVID19
291, Year 4 for Lockdown Lattimore ,2020-08-09 16:04:42+00:00,822,6524,,
292,Told Liam Kay had to work as a butcher during lockdown as he wasn’t getting paid by Toronto &amp; needed to pay his bills. Good to see him score,2020-08-09 16:04:24+00:00,8,90,,
293," ""The reassurance has grown as people come in. It's a case of the unknown, customers are not sure. We just need to let them come in, get a feel for it"" Managers of two pools have explained what a post-lockdown visit to their centres looks like #LoveSwimming @FreedomLeisure",2020-08-09 16:03:21+00:00,11,47,@FreedomLeisure,#LoveSwimming
294,I’ve lost quite a bit of weight during lockdown luckily ,2020-08-09 15:58:46+00:00,21,382,,
295,Thanks @winerepublic for highlighting the dreadful situation in which Cape Winemakers find themselves being unable to sell their wines in SA due to lockdown. They need our support &amp; the wines will repay in spades.#supportSAWine,2020-08-09 15:53:08+00:00,15,48,@winerepublic,#supportSAWine
296,Every penny I saved up over lockdown has been well n truly shagged,2020-08-09 15:51:55+00:00,6,82,,
297,"#lockdown isn’t so bad. Staying safe, in the sunshine, having a hot tub party! Happy Sunday! #LilacPower #BeMoreLilac #NeverGiveUp @shakira @wyclef @jasonderulo @bastilledan @marshmellomusic @willyfarquarson",2020-08-09 15:49:07+00:00,9,105,@shakira @wyclef @jasonderulo @bastilledan @marshmellomusic @willyfarquarson,#lockdown #LilacPower #BeMoreLilac #NeverGiveUp
298,"The COVID lockdown has created a different problem for office buildings: Legionnaires' Disease It forms in warm, stagnant water that is not properly disinfected. Sinks, toilets, and AC spread the bacteria through the air. ",2020-08-09 15:47:40+00:00,186,221,,
299,This muslim autorickshaw driver transported around 700 patients free of cost to the hospitals even in lockdown time! May God bless him ಈ ಮುಸ್ಲಿಂ ಆಟೋ ಚಾಲಕ ಲಾಕ್ ಡೌನ್ ನಡುವೆಯೂ 700 ಜನ ರೋಗಿಗಳನ್ನು ಆಸ್ಪತ್ರೆಗೆ ಉಚಿತವಾಗಿ ಕರೆದೊಯ್ದಿದ್ದಾರೆ! ಒಳ್ಳೆದಾಗಲಿ ,2020-08-09 15:47:09+00:00,5,28,,
300,"What are you talking about? 1. Can you provide some evidence of some global consensus that we're ""off our trolleys""? 2. Do you disagree that the Irish government ignored warnings re: meat factories? 3. Do people in lockdown counties not have the right to be annoyed? ",2020-08-09 15:46:47+00:00,10,142,,
301,Lockdown no longer necessary ,2020-08-09 15:45:32+00:00,28,44,,
302,"On a day when there is total lockdown in #TamilNadu Govt run #TASMAC shop in #Coimbatore sells liquor, allows people to sit in the bar. 100% privacy ensured &amp; two hoots for #COVID19 social distancing norms at Kovilmedu. Not sure what's #Coimbatore police is upto ",2020-08-09 15:42:46+00:00,251,435,,#TamilNadu #TASMAC #Coimbatore #COVID19 #Coimbatore
303,"“Lockdown” rhetoric framed primary role of government as prohibit &amp; restrict (not accommodate &amp; support) and when suppression through a “lockdown”-only strategy predictably fails, the electorate is primed to blame individuals rather than holding their elected leaders accountable.",2020-08-09 15:41:14+00:00,8,22,,
304,"Y’all: people barely have money for grocery how you could lockdown for two weeks, nib een paying out on time. ALSO Y’ALL: open up bamboo, I want Wendy’s, I want grouper dinna from KFC.",2020-08-09 15:39:16+00:00,40,138,,
305,I’ve been a bit quiet recently as I’ve been working on this! It was meant to be finished already but of course everything was temporarily paused during lockdown. Filming will continue this month with some amazing guests and wonderful friends. watch this space for updates! ,2020-08-09 15:38:33+00:00,7,39,,
306,Why call it a dating forum for lockdown skeptics when you could it OkStupid? ,2020-08-09 15:35:20+00:00,59,257,,
307,"I’ve been railing against the term “lockdown” for months. If you mean closing indoor gathering places like bars &amp; indoor dining &amp; prohibiting large gatherings, say that. If you mean a shelter in place order, say that.",2020-08-09 15:34:36+00:00,12,84,,
308,"I almost feel embarrassed reading some of the nonsense on Irish Twitter, about how awful we have it. We have it so good here. Good people are working hard to keep it that way. The fears that it might get worse are understandable - and that's why they did a local lockdown.",2020-08-09 15:34:16+00:00,10,169,,
309,Hitting the running track after almost 6 months is like an old addiction satisfied and craved... perfect cool weather and the lockdown lifted... thank God for the normal life. ,2020-08-09 15:34:08+00:00,15,226,,
310,We Need a Principled Anti-Lockdown Movement https://www.aier.org/article/we-need-a-principled-anti-lockdown-movement/ from @aier,2020-08-09 15:34:07+00:00,58,190,@aier,
311,You people have been watching too many Nollywood movies this lockdown Prince Azuka getting married to nkechi the village girl only happens on Africa Magic,2020-08-09 15:32:46+00:00,90,215,,
312,I knew about Timpsons sterling societal efforts before Covid-19 /lockdown - what a great example of a company who continues to give back #timpsonresponsible,2020-08-09 15:31:09+00:00,6,24,,#timpsonresponsible
313,Lockdown is bad branding. We should have called it freedom to chill.,2020-08-09 15:28:22+00:00,8,93,,
314,"If the government hadn’t squandered the first lockdown, and failed to test, test, test, we may well have averted this ",2020-08-09 15:23:50+00:00,202,463,,
315,"Happy birthday, #PhilipLarkin. Here’s @BlanchePictures lockdown film of #TheNorthShip with @PoetDeanwilson6 @ReeceShearsmith @jenniferhodgson @jgodberco @DrMatthewSweet &amp; @VickyFosterPoet to celebrate. Sending much to the marvellous @PLSoc today. https://twitter.com/shipsinthesky63/status/1271483059888627719",2020-08-09 15:21:55+00:00,11,29,@BlanchePictures @PoetDeanwilson6 @ReeceShearsmith @jenniferhodgson @jgodberco @DrMatthewSweet @VickyFosterPoet @PLSoc,#PhilipLarkin #TheNorthShip
316,"In a first-of-its-kind national survey on the impact of #COVID19 #lockdown on rural India, @GaonConnection is releasing its crucial findings tomorrow, August 10. #TheCovidRuralReport #GCRuralSurvey @RuralInsightsGC",2020-08-09 15:21:41+00:00,16,31,@GaonConnection @RuralInsightsGC,#COVID19 #lockdown #TheCovidRuralReport #GCRuralSurvey
317,Now that we’re on lockdown what a better time to work on your small business/brand BrandID-In-A-Box - Logo Design - Letterhead - Business Card - Quotation &amp; Invoice Templates - Domain Email Registration (T's&amp;C's) info@sanphusa.co.za 083 245 9033 #DJSBU #SanphuSA,2020-08-09 15:19:51+00:00,30,29,,#DJSBU #SanphuSA
318,"Young people in Preston have been warned ""don't kill granny"" by the city's council as local lockdown measures were enforced following a spike in #coronavirus cases. To read more, click here: https://trib.al/hFqis7c",2020-08-09 15:17:18+00:00,20,54,,#coronavirus
319,Latest blog post published: An introvert in lockdown. ,2020-08-09 15:15:18+00:00,6,81,,
320,"Manila is on lockdown, hardly any transportation but we did our very best to push through with our charity project, thanks to @BYouniversePh for accompanying and volunteering #윈터베어1주년_축하해 #태형이의선물_윈터베어_1주년 #1YearWithWinterBear #ThankYouKimTaehyung @BTS_twt",2020-08-09 15:14:29+00:00,205,495,@BYouniversePh @BTS_twt,#1YearWithWinterBear #ThankYouKimTaehyung
321,Lockdown supporters cannot bear the thought that Sweden has got it right ,2020-08-09 15:13:26+00:00,125,218,,
322,When the residents of Barcelona came out of the coronavirus lockdown they were greeted with miles of shiny yellow new bike lanes. Meet the man who's rethinking transit in a car-centric city (via @climate) https://trib.al/VmznUJz,2020-08-09 15:12:04+00:00,63,154,@climate,
323,Is there anything that isn't a sympton of #COVID? This is getting ridiculous now. @GovUK keep expanding the symptoms of #COVID so more people will get tested. They can then continue to ramp up the fear to justify the #Lockdown &amp; the vaccine. ,2020-08-09 15:11:00+00:00,34,60,@GOVUK,#COVID #COVID #Lockdown
