,Text,Date,Retweets,Favorites,Mentions,HashTags
0,Is it landlord that has been struggling since beginning of lockdown with no other source of income you want to beg. You people should better start renewing your rent.,2020-08-09 23:55:14+00:00,13,47,,
1,Victorian new cases trending down as impact of stage 4 lockdown kicks in. Thanks for staying strong everyone #auspol,2020-08-09 23:53:42+00:00,8,29,,#auspol
2,"Hello Monday. As Melbourne starts week two in lockdown and day three million of remote learning, here are five marvellous middle-grade titles to keep young readers entertained while you're on your next Zoom call. ",2020-08-09 23:48:01+00:00,7,23,,
3,The ironic part is the same people patting you on the back for this tweet were probably agreeing with the people protesting for the lockdown to end. Now we’re in this mess.,2020-08-09 23:47:48+00:00,5,75,,
4,"In several states, positive coronavirus tests have created problems at reopened schools, sending teachers, students, and parents into lockdown. In some cases, they’ve even shut back down ",2020-08-09 23:46:39+00:00,13,16,,
5,"Bonding With Our Pets: In a recent survey, about 73% of those surveyed said their pet helped their #mentalhealth during the lockdown, and 38% said they would consider a small pay cut so they could keep working from home with their pet. ",2020-08-09 23:40:02+00:00,20,38,,#mentalhealth
6,"Happy 65th birthday to @NeilKearney7. The boy from Longford who carved out a stellar career travelling the world telling stories, but still had time to drop off my lunch at school pretty much every day (I was very forgetful ). Can’t wait to celebrate when lockdown is over ",2020-08-09 23:39:30+00:00,2,140,@NeilKearney7,
7, BTS LOCKDOWN say no to antis/kpoppies report &amp; block. check your countries fanbase on charting info. keep up to date with how to stream properly on platforms available. Enjoy the comeback army @BTS_twt #BTS #BTS_Dynamite #BTSARMY,2020-08-09 23:37:40+00:00,12,17,@BTS_twt,#BTS #BTS #BTS_Dynamite #BTS_Dynamite #BTSARMY #BTSARMY
8,"World’s tiniest, rarest wild pigs are on swine fever lockdown https://trib.al/kEtDFCu",2020-08-09 23:36:03+00:00,20,61,,
9,"'Peers claimed almost £1m in taxpayer-funded “attendance” allowances while working from home during the lockdown. Since the rules were changed to pay peers £162 a day, participation has soared to record levels.' ",2020-08-09 23:32:25+00:00,94,38,,
10,"New Zealand marked 100 days since it stamped out the spread of #COVID19. The island country got rid of the virus by imposing a strict lockdown in late March, when only about 100 people had tested positive. ",2020-08-09 23:30:00+00:00,87,325,,#COVID19
11,It’s funny how easy it would be to basically end this nightmare. Only need a real 6-8 week lockdown paired with a temporary Universal Basic Income to cover everyone’s needs. Use that time to implement a nationwide system of testing and contact tracing.,2020-08-09 23:27:07+00:00,12,58,,
12,Frustrated by another weekend in lockdown? Get it all out by playing a pesky goose in UNTITLED GOOSE GAME. Tune in at 6pm tonight as we chat to @JKSTRSSR &amp;@sciencevsmagic from @house_house_ about their indie game mega hit. In partnership w @RMITGames https://bit.ly/goosegames,2020-08-09 23:26:04+00:00,12,37,@JKSTRSSR @house_house_ @RMITGames,
13,"In a time of of lockdown in big brothers house, the destiny of 85million rests in the hands of a young man his name is LAYCON... @Itslaycon for the 85M #LayconX85M #BBNaija",2020-08-09 23:22:18+00:00,106,680,@Itslaycon,#LayconX85M #BBNaija
14,Brian F and Rob Television have have really grown as contributors during this lockdown period. I'm really happy to see it as well. Both totally unique takes on how they approach the task.,2020-08-09 23:14:58+00:00,6,128,,
15,When the residents of Barcelona came out of the coronavirus lockdown they were greeted with miles of shiny yellow new bike lanes. Meet the man who's rethinking transit in a car-centric city https://trib.al/pewo4Rp,2020-08-09 23:12:04+00:00,55,149,,
16,"Pastor Rob McCoy of Godspeak Calvary Chapel in Thousand Oaks California will continue to defy lockdown orders. He says “I wish it didn’t have to come to this, I really do, but we will be violating the judge’s order. We will be open this Sunday.”",2020-08-09 23:10:17+00:00,148,495,,
17,Indeed. I got the impression from lockdown supporters that many were practically praying for more deaths in Sweden (“Give it 2 more weeks” was a continual refrain). But in didn’t happen &amp; it has remained a fully functioning country. Unlike Britain. ,2020-08-09 23:04:27+00:00,18,43,,
18,‘Masks Make Us Slaves’: Thousands March in Berlin Anti-Lockdown Protest - The Vaccine Reaction http://ow.ly/EEg750APIl9 #VaccineFreedom #InformedConsent,2020-08-09 23:02:01+00:00,56,90,,#VaccineFreedom #InformedConsent
19,"Trust in government is directly related to people's willingness to follow COVID-19 lockdown guidelines. In this Lancet study, the authors show a potential link between Dominic Cummings breaking the rules and decrease in public adherence to lockdown https://www.thelancet.com/journals/lancet/article/PIIS0140-6736(20)31690-1/fulltext?dgcid=raven_jbs_etoc_email",2020-08-09 23:52:54+00:00,5,18,,
20,"The dirtiest, easiest most delicious “fakeaway” recipe to come out of lockdown. ",2020-08-09 23:51:27+00:00,3,18,,
21,"The coronavirus crisis has seen a huge spike in Victorians presenting to emergency departments for self-harm or in mental distress. @CMorgan265 joined us to discuss the ""enormous"" impact lockdown can have on your mental health and where to go for help. ",2020-08-09 23:50:57+00:00,13,23,@CMorgan265,
22,during this lockdown I’ve started doing the smallest things I always rushed and it’s such a game changer. have you ever driven somewhere slowly and given yourself enough time to just look around and enjoy the drive?,2020-08-09 23:48:31+00:00,3,107,,
23,"""Lockdowns ended American life as we knew it just five months ago, for a virus that 99.4-6% of those who contract it shake off..."" - @jeffreyatucker We Need a Principled Anti-Lockdown Movement https://www.aier.org/article/we-need-a-principled-anti-lockdown-movement/ from @aier",2020-08-09 23:42:53+00:00,15,62,@jeffreyatucker @aier,
24,"Twitter world - I need a cake shop that is open in lockdown? Wilbas birthday on Wednesday. To answer a few responses for you, I wouldn’t eat a cake cooked from me .",2020-08-09 23:42:22+00:00,2,51,,
25,Planning a post lockdown spank bank *nods* Just doing my bit. ,2020-08-09 23:38:01+00:00,22,128,,
26,The Merri Creek is in pristine condition thanks to locals picking up litter during their lockdown exercise ,2020-08-09 23:37:47+00:00,4,22,,
27,America just needs to have a strict lockdown for ONE month and end this covid-19 stuff. Give everyone another stimulus check and quarantine for a month.,2020-08-09 23:36:41+00:00,5,23,,
28,Lockdown made twitter bad vibes cause everyone’s now got time to chat a load of shit,2020-08-09 23:35:26+00:00,6,21,,
29,WTF is going on?? NWO is very confusing. Sweden no lockdown or draconian laws. Australia military lockdown &amp; CCP type take over. How does this make sense ,2020-08-09 23:34:16+00:00,2,35,,
30,For 6 weeks Sophie - get a grip. It’s not you live in Hong Kong where they actually have had their freedom ripped to pieces. Do you realise how immature you Dan naysayers sound to those of us in States that had early lockdown and to the Victorians just doing what’s asked of them?,2020-08-09 23:32:35+00:00,2,86,,
31,"हुनर को काम में , और काम को आमदनी में बदलता रोज़गार ढाबा During the COVID-19 lockdown period, Mijwan Welfare Society #EmbrodieryCenter and #RozgarDhaba are creating work opportunities for rural women in the form of designer mask making (including Chikankari Mask).",2020-08-09 23:27:56+00:00,6,44,,#EmbrodieryCenter #RozgarDhaba
32,Would make a lot more sense to focus on at risk children of any color. I lose sleep thinking about the child abuse happening all over the world during the lockdown. People who should have never had children are locked in with them. So sad.,2020-08-09 23:13:55+00:00,7,80,,
33,I'd add to that any politician who was immediately extended indefinite lockdown and religious people are unessential. ,2020-08-09 23:13:18+00:00,1,26,,
34,"This is a terrific & constructive dose of perspective for those frustrated/challenged by lockdown (I've been there myself ). Stephanie Browitt lost family &amp; was badly injured in the NZ Volcano tragedy, but she reminds us ""with perseverance this will pass"" ",2020-08-09 23:11:58+00:00,9,32,,
35,@drjudymelinek I’m a geographer- you might like this regarding islands and population density. You weren’t here for our lockdown but it was strict and 99.9% of the team of 5 million were fully behind it and that’s why we’re Covid free today: ,2020-08-09 23:07:52+00:00,4,29,@drjudymelinek,
36,"Don't people understand that pandemic is a biological crisis? Not constitutional. Not economic. And definitely not political. In COVID19 pandemic crisis, you give all respect to the virus: masks, distancing, wash hands, and lockdown. So far America has not shown any.",2020-08-09 23:05:01+00:00,5,24,,
37,I spent an unnecessary amount of money on restaurants this weekend we need another lockdown,2020-08-09 23:02:27+00:00,4,9,,
38,New Zealand got rid of the virus by imposing a strict lockdown in late March when only about 100 people had tested positive for the disease. ,2020-08-09 23:00:02+00:00,17,64,,
39,"Got a proper haircut for the first time since before lockdown and feeling OK about it, so here. ",2020-08-09 22:57:06+00:00,0,144,,
40,Some of the cast and crew of #Host met up today! It was the first time we've seen each other since the start of lockdown (in March) and it was lovely Here's a snap from our socially distanced wrap party picnic and celebration of the film we made #HappySpookies,2020-08-09 22:51:31+00:00,8,132,,#Host #HappySpookies
41,Anyone else get the feeling that celebrities are claiming to have the virus that do not because with the lockdown and with TDS destroying our desire to see them they are losing their star status?,2020-08-09 22:50:53+00:00,26,84,,
42,"2020 is turning out to be like all those futuristic movies where the women are bald, everything is on lockdown, authoritarians are taking over and only one hero can save us all. That hero is @realDonaldTrump",2020-08-09 22:49:53+00:00,13,35,@realDonaldTrump,
43,Mongolia actually ran a practice lockdown of one of their provinces. Amazing.,2020-08-09 22:42:41+00:00,9,454,,
44,So i will be dropping a picture thread of some of my pictures i shot during this lockdown period.please kindly like and retweet and comment yoyr favourite too gracies #bbnaija2020,2020-08-09 22:41:17+00:00,26,82,,#bbnaija2020
45,Can we please go on a full lockdown now? COVID has been in the US for 8 months now &amp; we could’ve eradicated it months ago if we quarantined sooner.,2020-08-09 22:39:48+00:00,22,68,,
46,What day of Lockdown is this?,2020-08-09 22:39:20+00:00,4,156,,
47,"""Don’t Americans care about their health?"" ""They need to take our precautions...They need a real lockdown."" ",2020-08-09 22:38:43+00:00,5,36,,
48,Tonight was my first time in a bar since lockdown. ,2020-08-09 22:36:40+00:00,1,116,,
49,Lockdown supporters cannot bear the thought that Sweden has got it right ,2020-08-09 22:32:36+00:00,148,361,,
50,"I’m cringing. You’re an embarrassment, and you’re gonna get rinsed at the elections for saying this. A third of all young Black men in London were stopped and searched during lockdown - and here you are, saying this, playing down the Met’s institutional racism. Shame on you. ",2020-08-09 22:31:53+00:00,34,212,,
51,"US failure to contain the coronavirus has been met with astonishment and alarm in Europe — “Don’t they care about their health? They need a real lockdown. We’ve discovered a country that is very fragile, a public health system that is nonexistent” ",2020-08-09 22:29:32+00:00,132,131,,
52,"- there’s not been ever a slight suggestion that the people might get to vote on the issue; - encouraged snitch & shaming behaviour to help push compliance; - ignored the other human costs of lockdown: other deadly conditions not treated/diagnosed, deaths of despair..",2020-08-09 22:27:53+00:00,10,30,,
53,In all the debate about whether lockdown started on the 16th March (it definitely didn't) here is a thread to remind us that saying what could have been done sooner isn't just hindsight. ,2020-08-09 22:26:02+00:00,14,24,,
54,Find personal hygiene tiresome but still desperate for a date? Toby Young's lockdown sceptics website may be just the place for you... ,2020-08-09 22:22:14+00:00,11,17,,
55,COVID-19 lockdown daries ,2020-08-09 22:21:07+00:00,23,59,,
56,"My friends who made the lasagna have been in lockdown for as long as we have, save one instance where a medical procedure required a COVID test (negative). They’re in our learning pod. Only way I would do this for now.",2020-08-09 22:20:27+00:00,2,120,,
57,Lockdown glow up ,2020-08-09 22:14:38+00:00,12,47,,
58,How about this headline on the front page of newspapers instead of scare stories like Threat of Second Lockdown etc. Not a squeak about this good news or the reasons that the virus may be on the way out on ⁦@BBCNews⁩,2020-08-09 22:09:51+00:00,11,46,@BBCNews,
59,Can someone help us tell Laycon @Itslaycon that all his SM accounts are lockdown already . Almost 300k on IG. Over 80k on Twitters. iCONs soldiers full everywhere too. E be things already. #iCONsForLaycon #BBNaija,2020-08-09 22:09:26+00:00,136,677,@Itslaycon,#iCONsForLaycon #BBNaija
60,"Tomorrow there's the first photo teaser, comeback is so close!!!! Officially on BTS lockdown! Starting 11 pm KST let's use the ht #/1stDynamiteTeaser #MTVHottest BTS @BTS_twt",2020-08-09 22:06:01+00:00,77,113,@BTS_twt,#MTVHottest
61,starting from tmrw we are no a bts lockdown and i dont wanna see anyone engage with antis i only wanna see goals on the tl and ppl hyping up the boys,2020-08-09 22:02:26+00:00,40,97,,
62,"Raheem Sterling on the #UCL: ""We were extra hungry. I think the mentality since we got back in – day one after lockdown – has been how much we want this. We’ve got energy to progress in this competition. Energy and fight – we showed that against Madrid throughout the game."" ",2020-08-09 22:02:11+00:00,9,159,,#UCL #UCL
63,we basically been on lockdown for 5 months and minnis still ain’t come up with a better plan.,2020-08-09 21:58:59+00:00,55,106,,
64,"Did anybody actually read the New Zealand article? Three main measures they used: border control, lockdown and contact tracing. That’s literally all you can do.",2020-08-09 21:57:39+00:00,22,41,,
65,Sharing good news is always a good thing. F you NWO and F you lockdown lovers and second wave hopers https://www.express.co.uk/news/uk/1320683/uk-coronavirus-news-latest-second-wave-death-toll-infection-rate-herd-immunity?fbclid=IwAR1LojqaRsPoNuHjRUqUzACGYH9n04hzlYrZnkA4nLL4v_7rXnKBuc211cI,2020-08-09 21:55:49+00:00,113,192,,
66,Honestly what we gone do though? Lockdown the country until we have 0 cases then what? Open it back up for another wave? Then what? Lock it down again? Then what?,2020-08-09 21:52:32+00:00,48,94,,
67,The backstroke flags that our swimmers designed during lockdown It’s so good to be back at the pool with them @SwindonDolphin @Swim_England @WiltsASA @JMNSwimmer @britishswimming @SwimSouthWest,2020-08-09 21:52:11+00:00,9,129,@SwindonDolphin @Swim_England @WiltsASA @JMNSwimmer @britishswimming @SwimSouthWest,
68,Flagship/DBU got better today. Keep this lockdown tradition going,2020-08-09 21:51:51+00:00,34,201,,
69,"Counter-intuitively a main reason the media’s SO invested in lockdown still being 100% justified is potential damage from COVID (as proven by Sweden) is now SO much LESS than it was based on. Had COVID been closer to as forecast, they wouldn’t have SO much fear of looking stupid.",2020-08-09 21:48:27+00:00,22,84,,
70,I’ll take this moment of B.B.Brilliance to shamelessly plug the podcast we did with @BradBinder_41 in April during lockdown when he hadn’t even made a MotoGP appearance. Explaining just HOW rocky the road to MotoGP has been. @NeilHodgson100,2020-08-09 21:46:39+00:00,11,117,@BradBinder_41 @NeilHodgson100,
71,"Yes, very odd we don't have the bit where a Yorkshire car (as was 'suspected' at the time) was stopped for having the nerve to travel to London. Meanwhile, no police stopping London cars in Barnard Castle, under lockdown.......",2020-08-09 21:42:38+00:00,18,139,,
72,Follow @freenationtoday if you are based in Leeds and against this lockdown! What an amazing turn out today #leeds #leedsprotest #news #lockdown #Endlockdown #protests2020 #HumanRights,2020-08-09 21:41:42+00:00,51,132,@freenationtoday,#leeds #leedsprotest #news #lockdown #Endlockdown #protests2020 #HumanRights
73,"The order distinguishes between SECULAR and RELIGIOUS activities in the same location with the same people. THIS IS NOT ABOUT A VIRUS! Judge Orders Church to Stop Worship Services, Says It Violated Governor’s Lockdown ",2020-08-09 21:41:26+00:00,177,103,,
74,"Teachers have been on full day since #lockdown They are set to get a 3.1 per cent pay rise Now they want to work part time A life of leisure to them matters more than youngsters. education, doesn't it? They're a disgrace, aren't they? ",2020-08-09 21:37:44+00:00,37,77,,#lockdown
75,"The lockdown will be lifted on Mayaguana, Inagua, Long Cay, Crooked Island, Long Island, Rum Cay and Ragged Island on Monday at 5 a.m., Prime Minister Dr. Hubert Minnis announced on Sunday. He noted that those islands have not recorded any cases in the last two weeks.",2020-08-09 21:37:37+00:00,31,32,,
76,"Israeli Data Show School Openings Were a Disaster That Wiped Out Lockdown Gains ""Of 1,400 Israelis diagnosed with COVID-19 last month, 657 (47 percent) were infected in schools. Now 2,026 students, teachers, and staff have it, and 28,147 are quarantined. https://www.thedailybeast.com/israeli-data-show-school-openings-were-a-disaster-that-wiped-out-lockdown-gains?",2020-08-09 21:36:34+00:00,50,67,,
77,"These asshole government officials don't care about the mental health of people being in this fake lockdown. My son is 30. He is a wonderful, kind, quiet, shy man. He has depression and anxiety. For the first time, I am afraid. He is struggling. My heart breaks, they don't care.",2020-08-09 21:36:00+00:00,38,158,,
78,Is anyone else still living the lockdown life? I feel like some kind of strange hermit while the rest of the world moves on,2020-08-09 21:35:58+00:00,26,497,,
79,Minnis say we need to learn how to live with this virus but we still on lockdown? shut up.,2020-08-09 21:34:06+00:00,36,95,,
80,This adorable clip shows a baby gorilla trying to entice his father to play. Parents of children in lockdown might think it's a little too real ,2020-08-09 21:33:00+00:00,307,1752,,
81,"Although Zambia never went on lockdown, economy has taken a big hit.there are a number of financial lessons I have learnt.Have multiple income streams...get paid rent, do a consultancy, edit or proof read docs, bake cakes, drive ulendo but have a side hustle outside your day job",2020-08-09 21:32:38+00:00,23,91,,
82,bby is glowing in lockdown ,2020-08-09 21:32:31+00:00,7,49,,
83,"PM: Lockdown and curfew are lifted on Mayaguana, Inagua, Long Cay, Crooked Island, Long Island, Rum Cay and Ragged Island.",2020-08-09 21:30:51+00:00,101,142,,
84,"It definitely looks like a trend, SAGE scientists and their like, @IndependentSage, will already have a strong view about the direction Covid-19 infections are heading. Goodness schools are important, children’s futures vital, but alarm bells must ringing, loudly, now #lockdown?",2020-08-09 21:30:46+00:00,24,37,@IndependentSage,#lockdown
85,"Have you made some impulsive purchases during the COVID “lockdown” over the past few months? If you did, what were they? #implusebuy #spendingspree #poll",2020-08-09 21:29:12+00:00,45,54,,#implusebuy #spendingspree #poll
86,"Is anyone else alarmed that a body set up in May the Joint Biosecurity Centre based on the Joint Terrorism Analysis Centre now runs UK Govt #COVID19 policy, quarantine, lockdown all. Apart from a Dr Clare Gardiner membership is secret and unaccountable @carlheneghan @deb_cohen",2020-08-09 21:26:46+00:00,201,271,@carlheneghan @deb_cohen,#COVID19
87,First weekend out of lockdown and front page pic @SalfordDevils,2020-08-09 21:26:12+00:00,8,98,@SalfordDevils,
88,"Libertarians are entitled to comment, but pro-lockdown, pro ‘New Abnormal’ western ‘liberals’& neocons denouncing Belarus’s re-elected leader Lukashenko- who never imposed a Coronavirus lockdown or other illiberal CV restrictions, really do redefine the word hypocrisy. #Belarus",2020-08-09 21:26:05+00:00,44,126,,#Belarus
89,Bored during lockdown? Call a feminist group and ask to speak to the man in charge.,2020-08-09 21:24:09+00:00,104,221,,
90,"Denmark Says 'No Benefit' To Masks, Lockdowns Don't Work, COVID Tracking & Israeli/US Foreign Policy https://youtu.be/EbLV3DKvBOg #COVID19 #USForeignPolicy #Israel #Gaza #Yemen #BeirutExplosion #Masks #Lockdown #Vaccines #Bailouts #Technocracy #TheDailyWrapUp",2020-08-09 21:19:52+00:00,55,100,,#COVID19 #USForeignPolicy #Israel #Gaza #Yemen #BeirutExplosion #Masks #Lockdown #Vaccines #Bailouts #Technocracy #TheDailyWrapUp
91,Am I the only one that misses being on lockdown? Like Phase 1 Lockdown,2020-08-09 21:18:26+00:00,10,43,,
92,Most productive thing I did in this lockdown was download twitter lmao,2020-08-09 21:18:11+00:00,24,221,,
93,"If the US were to go into a uniform national lockdown, we could get COVID-19 under control in a matter of weeks, or a couple months tops. We’re just too stupid to do it.",2020-08-09 21:17:09+00:00,44,286,,
94,Erica alone has already invaded words to this lockdown season.... Mental vs physical attraction Special friend vs friend What re we expecting next from this damsel ??? #BBNaija pic.twitter.com/kt9ZQAkkJU,2020-08-09 21:16:13+00:00,13,85,,#BBNaija
95,I just realised I have interviewed 153 people on @3RRRFM so far this year - 130 done remotely while in lockdown. The #radiothon2020 is on in 2 weeks. This coming Sunday I have @AstroTerry and Dame Jocelyn Bell Burnell. It's our 30th Anniversary. So much science!,2020-08-09 21:13:31+00:00,4,42,@3RRRFM @AstroTerry,#radiothon2020
96,Minnis @5pm: “The lockdown will be extended” Jasper @4:59pm: PM:”The lockdown will be extended”,2020-08-09 21:09:40+00:00,154,469,,
97,I just over the slappin up.... just tell us if the lockdown extended or not dawggg ,2020-08-09 21:06:43+00:00,13,22,,
98,Is your state going back into lockdown mode? Comment which state,2020-08-09 20:59:40+00:00,111,968,,
99,"Lockdown was supposed to be a stopgap so we could figure out testing, tracing and isolation. It’s now month six.",2020-08-09 20:59:05+00:00,11923,35604,,
100,"The Tamil diaspora sent in millions in charity and aid when the North and East faced starvation during the COVID 19 lockdown, after the State weaponized the pandemic for political repression but provided no material assistance. ",2020-08-09 20:58:42+00:00,10,17,,
101,"So much good content (books & articles) produced during the lockdown. Have over 30 bookmarked articles on history, tech, development, culture or economics that I bookmarked. Add some 15 new books that I just discovered to that. What is left is time to read them.",2020-08-09 20:56:52+00:00,12,53,,
102,"So there is a lot of discussion about NZ and 100 days without a community spread Covid19 case on the timeline today. I would put it down to one thing, almost the entire country bought into the measures to control the spread. The lockdown polled at 91% support.",2020-08-09 20:53:12+00:00,11,45,,
103,What’s the first song you can’t wait to hear us play live when lockdown is over? ,2020-08-09 20:49:32+00:00,18,373,,
104,You can watch my latest lockdown session here. It was fun. It was hot. ,2020-08-09 20:49:09+00:00,8,62,,
105,"Hey friendly reminder that COVID numbers are going up again, but the gov’t doesn’t care enough to go back into lockdown because they don’t care about you as much as they care about the economy. Love yourself and others more than the gov’t does and wear the goddamn mask. PLEASE.",2020-08-09 20:48:23+00:00,42,116,,
106,"England can’t ease lockdown any more, experts including ⁦@JeremyFarrar⁩ + ⁦@IndependentSage⁩ warn as Covid testing calls grow",2020-08-09 20:47:09+00:00,74,111,@JeremyFarrar @IndependentSage,
107,"i tried to offer my friends on Discord a whiskey tonight. this isnt because of covid lockdown, ive always been very stupid",2020-08-09 20:43:42+00:00,2,102,,
108,"Up next. My choice from the outset to close my next project with the lady that has entertained, worked hard and supported others (including me) through dark moments during lockdown. She's our Queen of Hearts. Sunday headliner is @VeeBear - up next on http://greatmusicstories.com radio",2020-08-09 20:38:34+00:00,11,32,@VeeBear,
109,Strange as they didn’t pull up a car registered in London on the motorway to Durham in the middle of #lockdown #NotMovinOn #notmovingontilldomhasgone #SackCummings #CumGate #BorisHasFailedTheNation #BorisHasFailedBritain #BorisTheButcher #RussiaReport #COVID19 #postalvotes,2020-08-09 20:38:24+00:00,35,63,,#lockdown #NotMovinOn #notmovingontilldomhasgone #SackCummings #CumGate #BorisHasFailedTheNation #BorisHasFailedBritain #BorisTheButcher #RussiaReport #COVID19 #postalvotes
110,This is a self-filmed video and excerpt from “Burn” a finalist play in isolation during Lockdown. The winner of the 2020 Playwright’s Prize will be announced on Saturday August 15th at 6pm: ,2020-08-09 20:38:04+00:00,4,31,,
