,Text,Date,Retweets,Favorites,Mentions,HashTags
111,o lockdown em pelotas ,2020-08-09 20:36:11+00:00,1,39,,
112,"This could well be the anthem of the weekend. Chuffed looking back we played it first. For this weekend, a weekend about wellbeing, healing after the dark days of lockdown, this song speaks again. #Nowplaying @ScarletRebels #Heal",2020-08-09 20:36:06+00:00,7,24,@ScarletRebels,#Nowplaying #Heal
113,"Special stuff today. Nearly five months after going into lockdown, @gsyrugbyacademy got back on the pitch in the Isle of Man. To say they’d spent several hours sat on the plane going over, these guys put in some shift. Watch out for a full report on Monday’s @ITVChannelTV ",2020-08-09 20:33:49+00:00,14,57,@gsyrugbyacademy @ITVChannelTV,
114,"If you really enjoyed #EarpFest Lockdown Edition come joins us in Glasgow July 2,3,4 2021! We have sold out of HH (VIP) but will be putting the last remaining Lab Tech tickets on sale, still availability on the other tiers. Tickets will be available at the end of the month ",2020-08-09 20:32:39+00:00,24,219,,#EarpFest
115,New Zealand has now gone 100 days with no new local COVID-19 cases — and it hasn't been on lockdown since June. https://www.businessinsider.com/new-zealand-100-days-no-new-local-covid-cases-2020-8?utmSource=twitter&amp;utmContent=referral&amp;utmTerm=topbar&amp;referrer=twitter via @businessinsider,2020-08-09 20:32:31+00:00,32,61,@businessinsider,
116,Great the (unexplained) legal difficulties preventing this have been overcome. Only took a regional lockdown to get here. I’m sure that’s a complete coincidence ,2020-08-09 20:32:09+00:00,9,54,,
117,"I get told off if I post stuff like this too often, but it’s even more beautiful in lockdown. My daughter Erin &amp; her mates with their version of “The Luckiest” by @BenFolds",2020-08-09 20:30:35+00:00,8,71,@BenFolds,
118,"Two-thirds of UK’s furloughed workers continued job in Covid-19 lockdown | UK news | The Guardian Another, yes ANOTHER serious fcuckup by the U.K. Tory government..... It just goes on....and on....and on ⁦@RenewParty⁩ #ToryIncompetence",2020-08-09 20:29:35+00:00,22,18,@RenewParty,#ToryIncompetence
119,"This currently developing Hell was on our trajectory before Lockdown. The ANC’s policy outcomes have simply now been accelerated by events beyond their control and comprehension. This is who they are. This is who they always were. Stop enabling your own abuse, South Africa.",2020-08-09 20:27:43+00:00,15,62,,
120,"Whatever you and Andrew have been up to during lockdown keep at it you look very comfy on the Honda, great riding this weekend ",2020-08-09 20:26:48+00:00,1,73,,
121,the end of “vacation” in lockdown really does hit differently ,2020-08-09 20:19:48+00:00,3,138,,
122,BREAKING NEWS: Dr. Nkosazana Dlamini Zuma is expected to request for extension of Lockdown on Tuesday for another month. There are rumours that President Cyril Ramaphosa wanted to Lift the Lockdown but he is not getting support even though cases are decreasing. ,2020-08-09 20:16:38+00:00,14,72,,
123,"Republicans, Libertarians, Liberals: maybe we should consider all variables including the economy, mental health, risks by age groups and damage to minority communities before going full lockdown/school closures Leftists: ",2020-08-09 20:16:13+00:00,33,141,,
124,Lockdown seriously got me posing with trees ,2020-08-09 20:14:29+00:00,42,679,,
125,"@SharkWeek warming up with “Sharks of the Badlands” at 5pm if you haven’t seen it’s rad &amp; with my good mate @KinaScollay who also kicks off Shark Week 2020 tonight at 10pm with “Lockdown Sharks” which I was stoked to work on, incredible show shot with the best Great White Sharks ",2020-08-09 20:13:21+00:00,13,122,@SharkWeek,
126,Being in lockdown and taking football away has reignited the desire! Never thought I’d miss it but being back out there playing you just can’t beat it #football,2020-08-09 20:12:51+00:00,6,159,,#football
127,"After police intervention, the fire was extinguished by refugees. #Moria camp is not safe for these vulnerable migrants. They live in lockdown since more than five months without water and electricity.",2020-08-09 20:12:02+00:00,47,80,,#Moria
128,"WHO Director Tedros Adhanom - Gay, Red Terrorist Heads Global Lockdown https://www.henrymakow.com/2020/08/tedros-gay-red-terrorist.html A non-physician implicated in genocide; he is just the person to oversee the destruction of civilization. below- cruisin' at the local gay bar",2020-08-09 20:11:30+00:00,18,24,,
129,New video coming this week and a brand new track from the forthcoming collab album with @bernardbutlerofficial. It’s been a real curveball making these ourselves from our respective houses during lockdown. But I think you’ll enjoy the result! https://instagr.am/p/CDrmeUdHaX3/,2020-08-09 20:08:22+00:00,3,39,,
130,"The youngest and most dedicated volunteer , apprentice we have since March 2020 throughout lockdown. @abigia42 who’s project with @zinsideoutschul gave birth to @WasteNotProject in the beggining. These are the hopes of our next generation.",2020-08-09 20:07:45+00:00,3,27,@abigia42 @zinsideoutschul @WasteNotProject,
131,lockdown jensen is beautiful ,2020-08-09 20:05:18+00:00,37,112,,
132,"Truly an honor listening to our next #FLOTUS @DrBiden discuss motherhood, the trauma of lockdown drills, and how @MomsDemand @Everytown Survivor Network &amp; #StudentsDemandAction will help elect a gun sense president in November. #GSU2020 #WatchUsWork #MomsAreEverywhere @JoeBiden",2020-08-09 20:05:12+00:00,7,35,@DrBiden @MomsDemand @Everytown @JoeBiden,#FLOTUS #StudentsDemandAction #GSU2020 #WatchUsWork #MomsAreEverywhere
133,This would be the perfect post lockdown date. Chemistry that sparks across 2 metres is vital! #ASuitableBoy,2020-08-09 20:05:05+00:00,10,46,,#ASuitableBoy
134,"A National Lockdown Could Be The Economy's Best Hope, Says Minneapolis Fed President ",2020-08-09 20:04:03+00:00,38,67,,
135,Lockdown &gt; Pepper dem,2020-08-09 20:00:25+00:00,27,16,,
136,And this is precisely why the government are now saying that community transmission is inevitable. All that stands between us and a return to lockdown is THEIR sheer incompetence! Let’s vote them out before they lock us in! #nzpol,2020-08-09 19:59:41+00:00,6,30,,#nzpol
137,Fed's Kashkari advocates six-week economic lockdown to defeat the coronavirus https://cnb.cx/2DNAVpu I've been suggesting this for weeks. Wouldn't even have to be 6 weeks. 4 to 5 would do it. Most of those who are infected would have recovered and no longer be contagious.,2020-08-09 19:57:29+00:00,21,33,,
138,"I am wondering how a mask worrier and lockdown fan like you got Coronavirus. Strange. Maybe you ignored the rules that you favor, or maybe those measures don’t work as good as you think they work. Vote in the poll:",2020-08-09 19:56:49+00:00,200,693,,
139,"Loving this dress. I bought it during lockdown and it’s made from Ankara, which is an African wax printed fabric. I got it from Airboney, an Irish based Afro-caribbean fashion brand. ",2020-08-09 19:56:32+00:00,10,73,,
140,"I can acknowledge that I have a long term turbulent relationship with my body, as a gay man and as a man of fetish. I have used my time over lockdown to reflect on this and feel more comfortable within my own body, regardless of the troubles it causes for me. I am working on this pic.twitter.com/kADfXi2QFs",2020-08-09 19:55:24+00:00,7,81,,
141,"Don't people understand that pandemic is a biological crisis? Not constitutional. Not economic. And definitely not political. In COVID19 pandemic crisis, you give all respect to the virus: masks, distancing, wash hands, and lockdown. So far America has not shown any.",2020-08-09 19:54:29+00:00,27,175,,
142,"Around 190 countries imposed some form of lockdown An unproven strategy at containing viruses which would cause economic, social and health impacts for years to come Yet nearly every country did it Why? It’s been planned for years",2020-08-09 19:54:13+00:00,30,90,,
143,We started our tour of #Offaly last week with a trip to the wonderful Clara Bog. From there we headed west towards Shannonbridge and Shannon Harbour. So much to see in your lockdown county - find and enjoy! #Staycation #HolidayAtHome #Covid19,2020-08-09 19:47:45+00:00,7,72,,#Offaly #Staycation #HolidayAtHome #Covid19
144,"Here in NZ our freedoms depend entirely on Covid numbers. One unexplained case tomorrow could send us straight back into lockdown. Border controls must now stay in place for years. Hospitality, tourism and air travel industries have been decimated. Govt debt at an all time high.",2020-08-09 19:47:39+00:00,26,87,,
145,"UK could go back into lockdown next month, ex-government adviser warns ",2020-08-09 19:45:08+00:00,38,61,,
146,US-based British runner Marc Scott now holds the UK 5km records both indoors and on the roads and we profiled him in-depth before lockdown https://www.athleticsweekly.com/interviews/marc-scott-profile-1039931430/ @_MarcScott @BowermanTC @CambAndCol @BritAthletics @nikelondon @kimbia @TulsaTrack @podium5k @Jason_AW,2020-08-09 19:44:06+00:00,10,56,@_MarcScott @BowermanTC @CambAndCol @BritAthletics @nikelondon @kimbia @TulsaTrack @podium5k @Jason_AW,
147,What happened to a group of basketballers who underwent a 60 day lockdown? A new study gives us some answers - my latest for @hmmrmedia,2020-08-09 19:42:00+00:00,11,39,@hmmrmedia,
148,"Know what he was doing, he pretty much did. And his smart lockdown worked. It worked better than most countries &amp; if you are someone who truly believes in wanting what’s good for your country, you must see this. Call out the bad stuff. But don’t be blind to this. #coronavirus",2020-08-09 19:41:07+00:00,9,30,,#coronavirus
149,"My bum has actually tripled in size over lockdown and I’m only just realising none of my clothes fit, the day before I’m going out ",2020-08-09 19:39:47+00:00,2,61,,
150,"There's a personality type where interacting with other people is like eating your vegetables, it's stressful at the time, but if you don't do it, your mental health decays in the long term, so you force yourself to do it, and lockdown is bad because it takes a lot more force",2020-08-09 19:38:04+00:00,36,220,,
151,Can California avoid a second coronavirus lockdown? Its recent surge in cases illustrates the risks of reopening quickly. ,2020-08-09 19:38:04+00:00,33,102,,
152,So much people come up to me this weekend and said thank you for getting us through lockdown It made me really realise how powerful music is.. #MusicIsTheAnswer,2020-08-09 19:37:31+00:00,3,35,,#MusicIsTheAnswer
153,"Sunday walk around Bressay, haven’t been across to the island since before the start of lockdown, lovely to get back on such a beautiful warm sunny day, visibility was fantastic, amazing views with perfect panoramic blues #seascape #sky #shetlandsummer #shetland #bressay #walks – at Bressay",2020-08-09 19:36:26+00:00,11,77,,#seascape #sky #shetlandsummer #shetland #bressay #walks
154,I have not tweeted for a while as it's really though to stay positive in these stressful lockdown times with no winesales in South Africa! Our oxygen levels are extremely low &amp; President #Ramaphosa and his team are waiting for better days Please buy our wines abroad!,2020-08-09 19:33:17+00:00,19,77,,#Ramaphosa
155,"That doesn’t mean a new lockdown. It just means not socializing indoors, primarily, and following hygiene/distancing advice. That advice may very will turn into new restrictions if the trend continues to be negative.",2020-08-09 19:31:17+00:00,23,160,,
156,Here’s this weeks healthy todo list 1) Wear a mask and don’t be the idiot that doesn’t 2) Find a company in Kildare/Offaly/Laois that is closed due the lockdown and buy something on their website as a random act of kindness 3) Wash your hands,2020-08-09 19:29:54+00:00,517,2977,,
157,Post and go but also I miss my body looking like this.. lockdown ruined it all https://twitter.com/sihle_kunutu/status/1292473674222665728,2020-08-09 19:24:55+00:00,2,33,,
158,"The Lockdown, the fear &amp; hardship has pushed so many people beyond their limits. Jobs lost, no cash, tears of frustration, kids at home, fights, sleepless nights, lives destroyed. So many lived this daily before Covid. We have to build it back better than before. Never again! ",2020-08-09 19:23:41+00:00,8,52,,
159,Renew calls to sack Dominic Cummings after reported rise in lockdown rule-breaking since his Durham trip. Really? He won’t budge - ever. https://www.theneweuropean.co.uk/top-stories/public-lose-faith-in-no-10-s-covid-response-dominic-cummings-1-6781037,2020-08-09 19:22:49+00:00,24,36,,
160,boyfriend tom lockdown commencing all over again idgaf ,2020-08-09 19:21:59+00:00,2,88,,
161,y'all gonna b sick when my michelle obama pure lockdown violates the squad ,2020-08-09 19:19:43+00:00,6,20,,
162,"This is an old chat but there's nothing better than a long weekend, even in lockdown ",2020-08-09 19:19:06+00:00,5,101,,
163,"You're welcome Eric b4 ur arrival we already chose the Asoebi colour which is Lockdown green and pandemic gold, I'm glad you like it ",2020-08-09 19:18:09+00:00,25,249,,
164,"NZ is a trading nation. It’s exports have recovered from lockdown, job loss no.s are less than predicted, and bc NZs can travel and mingle anywhere within NZ, hospitality has not collapsed. Isolation = less deaths Fast action = less deaths Fast contact tracing = less deaths",2020-08-09 19:17:44+00:00,15,45,,
165,"20 weeks ago we went into lockdown and schools closed. Tomorrow, Scottish teachers return to school for what is sure to be the strangest first term in many years, if ever. I am nervous, excited and confident we will “get it right for every child”.",2020-08-09 19:15:18+00:00,6,251,,
166,‘We’ve gone on a lockdown sceptics dating forum by mistake.’ ,2020-08-09 19:12:41+00:00,54,415,,
167,"Hello Twitter Right at the beginning of lockdown me and @phonehome21 had a little idea which turned into Homestay. Over the moon to say we've been recognised by 5 festivals and if you haven't already watched on insta, here's the final film, enjoy!",2020-08-09 19:09:32+00:00,9,24,@phonehome21,
168,"Experts reckon when you tell people your ambition, you’re so much more likely to stick with it & achieve it. So Twitter folk, I’d like to lose 2 stone of Lockdown timber I’ve accumulated. Feeling pretty proud of managing a 5km run after only a week of pounding the streets. ",2020-08-09 19:08:19+00:00,0,118,,
169,Heard Portobello beach was mobbed today...if true what the hell are you thinking people we have not had any deaths in about a fortnight and infection rate was down seriously get a bloody grip folk we will end up in lockdown yet again because you selfish brats can't behave,2020-08-09 19:08:13+00:00,19,132,,
170,How are Indigenous peoples fighting for their lands during lockdown — while simultaneously addressing deep-rooted racial inequality? @ConservationOrg interviewed two Indigenous leaders and shares their insights. #IndigenousPeoplesDay,2020-08-09 19:06:00+00:00,21,47,@ConservationOrg,#IndigenousPeoplesDay #IndigenousPeoplesDay
171,Regan Grace spent lockdown racing greyhounds. ,2020-08-09 19:03:37+00:00,26,217,,
172,Omo Lucy fit use style win this BBNaija Lockdown edition o. Someone said her fans are our parents at home . Them no get time for twitter. #BBNaija #bbnaija2020 #BBNajia,2020-08-09 19:02:14+00:00,108,835,,#BBNaija #bbnaija2020 #BBNajia
173,"A diplomat and diplomatic scholar explore Dublin’s coast! Happy to be reunited after 7 months! Last time we met was in Rome pre lockdown, pre pandemic, pre madness. Glad to have friends who you meet after months, and pick up right where you left off! @curiouschiara #lovindublin",2020-08-09 19:01:03+00:00,8,181,@curiouschiara,#lovindublin
174,PHE Report based on 100 teachers during lockdown. Big enough and representative enough for September? I don't think so ,2020-08-09 18:59:52+00:00,10,30,,
175,The dramatic drop in greenhouse gases and air pollutants seen during the global lockdown will have little impact on our warming planet. However a strong green stimulus could keep the world from exceeding 1.5C of warming by the middle of this century. ,2020-08-09 18:59:00+00:00,64,89,,
176,Canceled a threesome the night before lockdown to let a friend crash on our couch and 5 months later let me tell you that friend has not sent even a single fruit basket as an apology.,2020-08-09 18:58:43+00:00,5,199,,
177,"Shoutout to the ladies that reject every guy and still end up with the wrong guy, I feel y’all pain ...... TB Pre lockdown #eljayxswizz #stolen",2020-08-09 18:55:15+00:00,6,63,,#eljayxswizz #stolen
178,"You can tell yourself it's because NZ is an island. But NZ is deeply enmeshed in the global economy--a lot intl throughput. NZ was the first country in the world to stop flights from Wuhan, and when they imposed a countrywide lockdown they had countrywide compliance ",2020-08-09 18:54:37+00:00,10,35,,
179,"I feel so bad for all the older people in lockdown, my nanny had just got back a little routine of going into town, getting her bits, going to mass etc &amp; now she’s back locked away essentially. this is infuriating because it could have been avoided. this is the governments fault",2020-08-09 18:50:28+00:00,2,261,,
180,We can’t share these posts enough. To remind people the true cost of the Govt unlawful lockdown measures that continue still! No Health Service anymore ,2020-08-09 18:49:59+00:00,101,149,,
181,"UK 'heading back into lockdown next month', says government's ex-chief scientist ",2020-08-09 18:47:54+00:00,108,100,,
182,Setting your alarm for work on a Sunday night really has you thinking “Maybe lockdown wasn’t too bad after all?”,2020-08-09 18:47:13+00:00,11,166,,
183,"Pretty productive 2020 so far, thanks 2 lockdown mainly! All these were taken with &lt;£1000 worth of kit, and that includes camera, laptop, barlow and ADC! #astronomy #Astrophotography #solarsystem #planets #STEM #Telescopes",2020-08-09 18:46:45+00:00,34,242,,#astronomy #Astrophotography #solarsystem #planets #STEM #Telescopes
184,Tochi has been evicted from the Big Brother Naija House Making him the 4th housemate to be evicted from the Big Brother Naija Lockdown reality show #bbnaija2020 #bbnaija2020lockdown,2020-08-09 18:46:44+00:00,6,48,,#bbnaija2020 #bbnaija2020lockdown
185,Off to @NandosUK tomorrow with friends I've not seen for over a year and I can't bloody wait! first time out properly since lockdown too ,2020-08-09 18:44:08+00:00,0,135,@NandosUK,
186,Y'all. I live in the first county in Norway that has commenced second lockdown after increase in cases after border opening. Haven't hugged my parents in 5months. Seen them only twice. Can everyone take this seriously and just be fucking careful?,2020-08-09 18:42:31+00:00,6,49,,
187,Some of the people we miss most during lockdown are our #AgentsofSHIELD family. We'll all be watching the last episodes on Wednesday night. Will you?,2020-08-09 18:41:38+00:00,6,67,,#AgentsofSHIELD
188,Thanks so much for having me back! @TheGrandClapham is one of my favourite venue in the whole world and so happy to be on the stage. Aaaaand this was my first live show after the lockdown and I’m so emotional now... Thank you. ,2020-08-09 18:40:12+00:00,5,52,@TheGrandClapham,
189,"So, @DawnButlerBrent gets stopped driving around London whilst Dominic Cummings drives hundreds of miles, breaks lockdown rules and nobody seems worried. We might well ask why the difference in treatment between those two people...and I’m not just talking about the Police here ",2020-08-09 18:38:06+00:00,1207,5266,@DawnButlerBrent,
190,"Don't people understand that pandemic is a biological crisis? Not constitutional. Not economic. And definitely not political. In COVID19 pandemic crisis, you give all respect to the virus: masks, distancing, wash hands, and lockdown. So far America has not shown any.",2020-08-09 18:36:17+00:00,8,83,,
191,EDITORIAL: The never-ending lockdown of 2020 ,2020-08-09 18:35:54+00:00,89,161,,
192,"Feedback of some traders of Lahore, after ending #COVID19 lockdown: ",2020-08-09 18:35:04+00:00,323,765,,#COVID19
193,Durness 'swamped' by post-lockdown roadside campers ,2020-08-09 18:34:51+00:00,16,36,,
194,"MUST READ Belarus President has exposed that #WorldBank #coronavirus aid comes with conditions for imposing extreme lockdown measures, model COVID-19 response on that of Italy &amp; even changes in economic policies which he refused as being “unacceptable”. ",2020-08-09 18:30:12+00:00,25,29,,#WorldBank #coronavirus
195,Weird to think that life would be so different right now if lockdown/corona hadn’t happened,2020-08-09 18:29:22+00:00,6,44,,
196,"As of August 6, only 15.3% of Navajo Nation households have self-responded to the 2020 Census. During the 32-hour weekend lockdown, please take a few minutes to self-respond. You can respond online, by mail, by phone, or in-person. Ahe’hee’ ",2020-08-09 18:27:36+00:00,25,59,,
197,Pre and Post lockdown. ,2020-08-09 18:24:33+00:00,59,1661,,
198,Boris can poke his lockdown up his arse until he puts every illegal that arrives in secure detention centres . Why the fuck should we comply when these savages are free to roam our streets and infect us anyway,2020-08-09 18:20:30+00:00,24,62,,
199,"Played my first 6 a side game since lockdown tonight, bagged So unfit tho But good to be back Anyone else back playing yet?",2020-08-09 18:20:29+00:00,1,188,,
200,"I still don’t understand people who think that Covid won’t work it’s way through the population regardless of lockdown. Countries who front-loaded their deaths by late or voluntary lockdown (UK, Italy, Sweden) are in the best position now with high level of population immunity. ",2020-08-09 18:18:42+00:00,12,31,,
201,Our latest post (Don’t get Petfished: Vets and Celebrities Lead Public Warnings Against ‘Cruel and Opportunist’ Lockdown pet Sellers) is now live! Please check it out on https://katzenworld.co.uk/2020/08/09/dont-get-petfished-vets-and-celebrities-lead-public-warnings-against-cruel-and-opportunist-lockdown-pet-sellers/ #cats #katzenworld #catlovers :D,2020-08-09 18:16:32+00:00,6,29,,#cats #katzenworld #catlovers
202,"To face mask police / politicians, as long as 1 person, on the planet has the Covid-19, China Virus, the virus will always be here. It’s not going away. Do you want to live the rest of your life in lockdown? Wearing a face mask? What kind of life are you going to choose? ",2020-08-09 18:13:49+00:00,235,159,,
203,Lockdown supporters cannot bear the thought that Sweden has got it right ,2020-08-09 18:13:32+00:00,19,29,,
204,"where was this energy for 97 liners? yet they still got dragged by these double standard btches even though there was no lockdown in sk implemented atm, thats when you know they don't care about any of this once bts is involved they are bound to get drag. ",2020-08-09 18:11:16+00:00,129,564,,
205,President Trump's executive orders avoids the radical provisions disguised as Pelosi's stimulus package. Learn more of what she's tied to include in a bill that isn't designed to help America's working families during our recovery from the lockdown. ,2020-08-09 18:10:00+00:00,442,1012,,
206,"Socially intolerable Protecting your adviser who broke lockdown rules Economically unsustainable The biggest drop in economic output in the G7 with millions of job losses to come Morally indefensible Your policy of ""take it on the chin"" leading to 70,000 deaths Own it ",2020-08-09 18:09:07+00:00,28,57,,
207,Police stopped Dawn Butler for a ‘Yorkshire number plate’ but Dominic Cummings took his kids on a potentially blind joyride and a 260 mile trip during lockdown and he held a press conference about why that’s okay,2020-08-09 18:06:50+00:00,6625,30023,,
208,"Yes it must be the lockdown that’s making dating hard for selfish, reckless conspiracy nuts. ",2020-08-09 18:06:46+00:00,5,68,,
209,Lockdown Windhoek Lookdown Windhoek Lockdown Windhoek Lockdown Windhoek Lockdown Windhoek Lockdown Windhoek Lockdown Windhoek Lockdown Windhoek,2020-08-09 18:05:45+00:00,9,33,,
210,Victorian lockdown may lead to supermarket supply issues – but panic buying impact greater ,2020-08-09 18:05:25+00:00,22,35,,
211,"""If we value our scientists, our science will surely benefit"" One PhD student shares his experiences of lockdown and his concerns for the future https://elifesciences.org/articles/59285?utm_source=twitter&amp;utm_medium=social",2020-08-09 18:03:01+00:00,14,33,,
212,"While EFF is coming up with innovative ideas during lockdown to celebrate #EFFWomensDayRally haters are busy criticizing. Lol we are coming back to you this is just the beginning. Good night CIC Julius Malema, EFF leadership, ground forces, fighters on the continent &amp; in diaspora",2020-08-09 18:02:32+00:00,31,251,,#EFFWomensDayRally
213,"Prominent Minnesotans are calling for a strict, state-by-state lockdown to suppress COVID-19, saying tougher restrictions in the short-term would save lives and more quickly restore the economy. ",2020-08-09 18:01:00+00:00,16,68,,
214,Poll: Should the lockdown be lifted?,2020-08-09 18:00:46+00:00,12,13,,
215,What’s being reclaimed is the sense of open public spaces enjoyed without the mediation of a paid-for event - my piece on our lockdown love of parks ,2020-08-09 17:59:37+00:00,30,118,,
216,"The only reason I made a track called 'G' is cos I wanted track 5 on the album which is all about our pandemic lockdown to read ""5G"" lol ",2020-08-09 17:56:44+00:00,8,39,,
217,"Be aware that city of #Minsk, #Belarus is under total lockdown. #belaruselection",2020-08-09 17:56:27+00:00,48,78,,#Minsk #Belarus #belaruselection
