,Text,Date,Retweets,Favorites,Mentions,HashTags
324,"The problems with high-stakes testing were magnified by lockdown, with universities demanding that students infect their computers - often shared with family members - with spyware that claimed to perform ""invigilation"" (anti-cheating surveillance). https://pluralistic.net/2020/04/15/invigilation/#invigilation 2/",2020-08-09 15:08:36+00:00,37,100,,
325,"Seattle Times is 100% propaganda on Covid Flu: - There's no ""outbreak"", just more testing - Comparisons between lockdown / non-lockdown countries show lockdowns counter productive - Kids are at greater risk from flu, more likely to die by lightning strike, don't pass to adults ",2020-08-09 15:08:30+00:00,43,83,,
326,The weather gods blessed John’s first post-lockdown gig. A perfect afternoon at the @roseandmonkey .,2020-08-09 15:05:13+00:00,5,60,@roseandmonkey,
327,"""During this pandemic, a worrying result is an increased number of children coming into care in the local area"" Yet more, tragic, collateral damage from the illegal lockdown ",2020-08-09 15:04:19+00:00,113,209,,
328,"When i heard that the FG has spent N500 million on feeding school children during lockdown. Said by ""Hajiya zubaidatu zubairu mazugal"" ",2020-08-09 15:03:53+00:00,38,92,,
329,"UK Coronavirus infections have just hit a 44 day high. We are back to the levels we saw in June. Someone is now infected with Coronavirus in the UK every 80 seconds. The two main UK parties are to blame. They supported the early lifting of lockdown, especially public indoors.",2020-08-09 15:03:41+00:00,755,1484,,
330,"To manufacture consent for extreme #lockdown measures including executive #mask-wearing orders, the New York Times has systematically deceived readers about #SARSCoV2 transmission.",2020-08-09 15:03:02+00:00,71,109,,#lockdown #mask #SARSCoV2
331,Super-rich families are buying multiple citizenships to prepare for the next lockdown. Here's how citizenship-by-investment programs work and why they're getting more popular. ,2020-08-09 15:01:05+00:00,265,498,,
332,"""A UK professor from the University of Oxford has revealed how the peak of the UK’s coronavirus ‘crisis’ actually came a full week before Boris Johnson initiated lockdown on March 23rd."" This means the UK lockdown was unnecessary. ",2020-08-09 15:00:58+00:00,72,79,,
333,"Do we all agree that the term ""lockdown"" obscures more than it illuminates?",2020-08-09 15:00:19+00:00,9,125,,
334,"Lockdown has given a window into people’s home lives, their families, their relationships and has only reminded me what a dysfunctional home I came from. *But* it’s also made me extremely proud that I’ve still been able to accomplish my dreams and live beyond my trauma.",2020-08-09 14:58:22+00:00,2,168,,
335,"What are the chances that the people who stripped shelves bare in the early days of lockdown as they’d ‘do anything to protect their family’ - are the same people frothing at the mouth about ‘invading immigrants’ who are doing the same, at much greater risk?",2020-08-09 14:57:36+00:00,4,61,,
336,The truth behind lockdown... @eNCA @NARI_SSA @hrw @afriforum @NBCNews @BBCWorld @PresidencyZA @CyrilRamaphosa @Corruption_SA @PublicProtector @realDonaldTrump @toekomsvonk @VFPlus @BlessingsRamoba @Unathi_Kwaza @c_tamia99 #anarchy #terrorist #crime #StateCapture #Lockdown ,2020-08-09 14:47:30+00:00,91,93,@eNCA @NARI_SSA @hrw @afriforum @NBCNews @BBCWorld @PresidencyZA @CyrilRamaphosa @Corruption_SA @PublicProtector @realDonaldTrump @toekomsvonk @VFPlus @BlessingsRamoba @Unathi_Kwaza @c_tamia99,#anarchy #terrorist #crime #StateCapture #Lockdown
337,Finally finished the lockdown bar project and who else could we name it after but these 2 legends @NoelDavidWhelan @apopey #FreeBenWhite,2020-08-09 14:38:27+00:00,27,456,@NoelDavidWhelan @apopey,#FreeBenWhite
338,Mary Cullen took this lovely snap in #Brighton during lockdown. She would love to find the couple pictured... do you know who it is?? ,2020-08-09 14:37:00+00:00,35,73,,#Brighton
339,"#BTC #ETH Dear Crypto frds @BitSigmaBTC, top BTC analyst, helped 20089 fans earn 4232.62%! To help more frds beat COVID Lockdown, OKEX invites me share signal freely Join can really get OKEX 40$Bonus: https://t.me/okexeduEN @cctip_io airdrop 5000 DOGE 1000 #BitSigmaBTC",2020-08-09 14:36:13+00:00,316,450,@BitSigmaBTC @cctip_io,#BTC #BTC #ETH #BitSigmaBTC
340,"100 days without Covid-19 for New Zealand. -Ongoing border controls to stop Covid-19 from entering the country -A lockdown &amp; physical distancing to stop community transmission -Case-based controls using testing, contact tracing &amp; quarantine. #FreshTopics",2020-08-09 14:35:58+00:00,31,63,,#FreshTopics
341,"I'm still stunned that the NYT ran this. If you grok this point, the whole lockdown narrative falls apart. ",2020-08-09 14:35:53+00:00,34,87,,
342,We should’ve had a national lockdown in March with mandated masks and fines for those who don’t comply. There will be 200K dead by Labor Day. Trump and those who didn’t take this seriously need to be held accountable for murder. This is murder.,2020-08-09 14:33:17+00:00,23,85,,
343,My life was in bits before lockdown and now I am living my best life and being the happiest version of myself ever yay,2020-08-09 14:33:17+00:00,12,74,,
344,If you’re still proposing lockdown you should take this on board: UK to plunge into deepest slump on record with worst fall in GDP among G7 ,2020-08-09 14:32:59+00:00,206,542,,
345,Lockdown has taught me how to do my own gellish nails | Happy Women’s Day #WomensDay2020,2020-08-09 14:29:20+00:00,16,715,,#WomensDay2020
346,I've just started exploring my creative side during lockdown but found out I love sculpting and casting resin ,2020-08-09 14:25:33+00:00,2,85,,
347,Since the lockdown which is the biggest song that has came out?,2020-08-09 14:25:28+00:00,44,463,,
348,A future look at the first meet-up of Toby Young’s Lockdown Sceptics ,2020-08-09 14:23:29+00:00,263,1173,,
349,Day 2 of EarpFest Lockdown Edition has started! Panels today: 4pm Pet Tales with @KateDrummond_ 5pm Weird Sceince @VarunSaranga 6:30pm This Price is Right @DaniKind 7:30pm Earptionary @KatBarrell All times BST (London),2020-08-09 14:18:52+00:00,25,165,@KateDrummond_ @VarunSaranga @DaniKind @KatBarrell,
350,"Zoos across the world say their animals are becoming 'lonely' without visitors as a result of lockdown. So sad to think of these animals so habituated that they miss people staring at them, &amp; tapping on their glass. They deserve much better. ",2020-08-09 14:16:10+00:00,19,35,,
351,Lockdown has sparked a movement to reconnect to nature: - British Caoneing has seen 40% rise in members: https://www.theguardian.com/lifeandstyle/2020/aug/09/up-the-creek-with-19000-paddles-as-uk-takes-to-the-water - Sales of camping gear up loads: https://www.theguardian.com/business/2020/aug/06/uk-staycation-boom-lifts-sales-of-camping-gear - People have rediscovered parks as ‘green lungs’: https://www.theguardian.com/travel/2020/aug/09/sanctuary-in-the-city-how-urban-parks-saved-our-summer?CMP=Share_iOSApp_Other #RightToRoam,2020-08-09 14:14:10+00:00,15,47,,#RightToRoam
352,"Made with EaseCopy by @by.grais: ... ""My Lockdown Routine. ⁣ ⁣ So here’s an animation of what I do all day. Not proud of it ⁣⁣ ⁣⁣ Let me know how you have been coping with this lockdown.⁣ Get EaseCopy https://bit.ly/3ebNl8a #aescripts #aftereffects ⁣",2020-08-09 14:14:05+00:00,8,73,@BY,#aescripts #aftereffects
353,"PM @narendramodi released the sixth installment of funds to 8.5 crore farmers under #PMKisan scheme. The scheme has been instrumental in supporting farmers during #COVID19 pandemic through release of nearly Rs 22,000 Crore to aid the farmers during #lockdown. @ROBChandigarh",2020-08-09 14:13:47+00:00,18,38,@narendramodi @ROBChandigarh,#PMKisan #COVID19 #lockdown
354,I have noticed this cancer spreading in schools here too. The lockdown has opened my eyes to the brainwashing my kids were getting. ,2020-08-09 14:13:33+00:00,38,163,,
355,"Sweden has no masks, no social distancing, and no Coronavirus cases. It also has population immunity and a strong economy. No wonder the media, embarrassed about promoting lockdown, are slow to praise them. ",2020-08-09 14:10:11+00:00,31,56,,
356,"This unfortunate woman on Toby Young's 'Lockdown Sceptics' dating forum (yes, really!) is on a loser from the get-go... ",2020-08-09 14:07:41+00:00,12,40,,
357,Just posted a video on HOW I GOT RID OF MY DARKSPOTS/SCARS: since I had a major breakout beg of the lockdown!!!!!!! https://youtu.be/0FKjzWZKKNk,2020-08-09 14:07:40+00:00,24,48,,
358,"my birthday was during the lockdown but still nobody made that birthday wish video thingy for me, pathetic",2020-08-09 14:07:10+00:00,5,126,,
359,"So delaying lockdown didn’t protect the economy. Next, Brexit won’t be the sunny uplands either. ",2020-08-09 14:05:44+00:00,9,25,,
360,I had my first gig after this lockdown bs today . It was pretty good to sing live again The clients were happy and even tipped me Ugandans tebavikako kabwe so by the time you're tipped heeee ,2020-08-09 14:05:15+00:00,32,210,,
361, no way! “Lockdown Lunatics and their Lovers”. It’d be like a Who’s Who of hard drives that needed checking.,2020-08-09 14:05:03+00:00,25,435,,
362,"Top TRP of #Thalaivar Films on Tv Channels, During Lockdown Period. #45YearsOfRajinismCDP",2020-08-09 14:05:02+00:00,197,100,,#Thalaivar #45YearsOfRajinismCDP
363,Really excited to hear Toby Young will be finding love for my lady here with his singles forum for lockdown sceptics. ,2020-08-09 14:02:21+00:00,77,480,,
364,"Even though you are so successful doctor, you are always there for help even for strangers in the times of need. Your medicines saved my father from severe back pain when there was lockdown and everything was closed.! Only Hinduism can teach selflessness. Jai Shree Ram! ",2020-08-09 14:01:57+00:00,5,106,,
365,“Don’t let history repeat itself” – Australian speaks out on draconian lockdown http://ow.ly/pIGc30r3pX3,2020-08-09 14:01:50+00:00,176,408,,
366,Toby Young's anti-lockdown dating website is going well ,2020-08-09 13:58:22+00:00,58,261,,
367,What’s the ratio of men to women on a “lockdown sceptics’” dating site going to be? ,2020-08-09 13:56:05+00:00,14,100,,
368,"2Cr jobs/yr & much more hopes was promised by Modiji.But his asinine rule banged the nation with 14Cr unemployment, demonetization, wrong gst and failed lockdown.What more can u do PM to crack our economic structure completely?#RozgarDo @IYC @srinivasiyc @Allavaru @Ravindradass",2020-08-09 13:56:02+00:00,115,271,@IYC @srinivasiyc @Allavaru @Ravindradass,#RozgarDo
369,"No sane excuse for not doing the right thing. Without a vaccine the best thing was to lockdown, wear a mask, and flatten the curve. US needed a national plan. Trump failed miserably. His poor leadership, denial, deflection, lying, and reckless politics ruined a faster recovery.",2020-08-09 13:55:31+00:00,22,486,,
370,"Here's what exhausts me. Several times per day, a hugely credential expert blasts the lockdowns, calls for schools to reopen, discusses immunity realities, and blows up the media narrative. Still the NYT blithely says: science wants another lockdown.",2020-08-09 13:54:59+00:00,168,507,,
371,"It’s pretty f*cked over here in Victoria, Australia. I’m almost shocked at people’s inability to even question all of the crippling lockdown restrictions being put in place. I know people are bluepilled bootlickers &amp; whatnot, but it’s worse than I even expected.",2020-08-09 13:54:12+00:00,11,76,,
372,"12 months, 12 lives: Kashmiris in limbo and lockdown ",2020-08-09 13:54:04+00:00,52,57,,
373,"Op-Ed: If states don’t coordinate lockdown procedures immediately, our future is grim https://www.latimes.com/opinion/story/2020-08-09/coronavirus-spread-patterns-social-influence (via @latimesopinion)",2020-08-09 13:48:01+00:00,54,107,@latimesopinion,
374,Volunteers are wanted to take part in a Lake District litter pick after a rise in rubbish following the easing of lockdown. ,2020-08-09 13:45:31+00:00,11,34,,
375,"Day 99/100 of #OneMillionSteps and for those of you who are new or have forgotten, this whole 100 day thing was supposed to end with the final day of lockdown, which was scheduled to be tomorrow. That hasn't happened. Instead, we're facing into more uncertainty than ever. (1/?)",2020-08-09 13:38:08+00:00,3,93,,#OneMillionSteps
376,"Coronavirus BOMBSHELL: National lockdown could be re-imposed next month https://www.express.co.uk/news/uk/1320495/Coronavirus-news-Covid-19-lockdown-September-scientist-Sir-David-King More of Boris's lies, didn't he just say there wouldn't be another National Lockdown?",2020-08-09 13:35:59+00:00,177,233,,
377,"I miss this dork *remember when before the lockdown, Scarlett was supposed to guest again on Kelly and Ryan show ",2020-08-09 13:23:32+00:00,11,42,,
378,"This study was with pupils attending key worker provision during lockdown. At my school, we had approx 6 pupils per day who sat 3 desks separated from each other. This is vastly different from normal school operations with nearly 1800 pupils sharing corridors &amp; classrooms.",2020-08-09 13:20:58+00:00,13,67,,
379,"Lockdown has been cruel to journalists &amp; cartoonists. Two things helped me survive this tough phase, in spite of losing around 6 clients. As a freelancer I wasn't depending on one client &amp; some caricaturing projects. Meanwhile it was refreshing to get an offer from Gulf News. ",2020-08-09 13:20:48+00:00,753,5595,,
380,Lockdown wedding &gt;&gt;&gt;&gt;&gt; ,2020-08-09 13:19:48+00:00,24,226,,
381,"Q: What is your most hated pro-mask/lockdown comment? Mine has to be the classic: ""If you don't like wearing a mask, you'll love a ventilator"" *RAGE INTENSIFIES* #Scamdemic #CovidHoax #NoNewNormal #NoMasks #EndLockDownTotally #dontwearamask",2020-08-09 13:18:26+00:00,17,218,,#Scamdemic #CovidHoax #NoNewNormal #NoMasks #EndLockDownTotally #dontwearamask
382,"Popped out for a walk last night in Manchester... I can report that in the abscence of resources to enforce, support for businesses, or trust in the benefits of goverment guidelines, 'local lockdown' might not 'be a thing'. Either that or people live in really big households",2020-08-09 13:17:31+00:00,6,127,,
383,"""System to return people not fit for purpose"" Weak excuse! It is the government's job to protect our nation, overburdened taxpayer's & our crumbling welfare state. When it comes to the lockdown, absolute control was enforced - but when it comes to our borders? Excuses, excuses. ",2020-08-09 13:16:40+00:00,58,192,,
384,"I caught up with Francisca on the phone. She's doing well in lockdown in Amsterdam, and glad to see 1965 discussed again. She told me that, when talking about my book, I must always put the events in the larger context of Western colonial exploitation of the Third World. She's 94 pic.twitter.com/hO9x6rlPgZ",2020-08-09 13:15:54+00:00,9,195,,
385,"Tomorrow the lockdown will END &amp; check out the CRAZY traffic jam right now, as people head to Naraan for vacation! Who will follow SOPs on such messy roads &amp; overbooked hotels?! Please go easy, guys! We CAN'T afford another spike in #coronavirus - please! ",2020-08-09 13:15:20+00:00,182,621,,#coronavirus
386,So much of the debate around coronavirus is based on trade-offs. Lockdown vs opening up. Health vs economy. Pubs vs schools. Truth is everything is a knock-on effect from the govt fucking up. Now the virus is still too prevalent but we’re desperate for normality we haven’t earned,2020-08-09 13:15:07+00:00,70,383,,
387," New OPED Today in the @latimes If States Don't Coordinate Lockdown Procedures Immediately, Our Future is Grim. ",2020-08-09 13:12:20+00:00,72,168,@latimes,
388,COVID-19 is unlikely to mean the end of physical conferences entirely. Yet many hope that the global health crisis will change meetings forever. Nature spoke to scientists involved in lockdown conferences to get their thoughts and advice. ,2020-08-09 13:11:00+00:00,41,85,,
389,At lockdown @ReadaCronin was first Kildare TD to press govt for special urgent grants for small business. Now others following her lead. She Is 100pc right. Small business cannot take the hit for big-business profit. #kildarelockdown #COVID19,2020-08-09 13:11:00+00:00,25,94,@ReadaCronin,#kildarelockdown #COVID19
390,"Hi @laurenlaverne thank you for asking about our members fighting to save 200+ jobs, it's not entirely true that all @Tate workers were paid in full over lockdown, security guards and cleaners had a 20% pay cut while on furlough and are now still lacking occupational sick pay ",2020-08-09 13:07:45+00:00,28,67,@laurenlaverne @Tate,
391,"Read almost 70 books during lockdown. 1. Busted AIT theory 2. Found Indian leadership status from antiquity 3. Found Budha's ashes in India 4. Mahabharata Kaal found from an inscription in Jain temple, KAR 5. Wrote on DARK witch hunting and western feminism Contd... @ShefVaidya",2020-08-09 13:06:49+00:00,24,110,@ShefVaidya,
392,What is a disgrace is that journalists like this one are diverting the heat from government policies that have put meat plant workers and asylum seekers at risk and brought about the need for a lockdown in three counties. Do your job and hold them to account. ,2020-08-09 13:06:29+00:00,10,71,,
393,"COVID-19 update, Sweden edition. Sweden's actual day of death chart. One (!) COVID-19 death recorded that is tracked from the month of August thus far. Herd immunity achieved? No masks. No lockdown. No problem. https://experience.arcgis.com/experience/09f821667ce64bf7be6f9f87457ed9aa",2020-08-09 13:05:09+00:00,696,1291,,
394,"The tide is turning. People are coming to the realization that this is ALL bullshit. The lockdown was never required. It was done in a panic and now politicians are afraid to open things up, lest it be a reflection of how they were/are responsible.",2020-08-09 13:05:05+00:00,30,220,,
395,It was us in New York. Lockdown. Curfew. Masks. Social Distance. Wash Hands. REPEAT,2020-08-09 13:04:58+00:00,11,77,,
396,"Of course I think kids should resume face to face educatuon but Boris claiming its '""teachers' moral duty"" makes me sick. It was Cummings' moral duty as a responsible citizen to obey the lockdown rules - not forgotten",2020-08-09 13:03:23+00:00,27,63,,
397,Jess reveals how she and husband James dealt with the loss of their son Leo - and the effect lockdown had on their grief ,2020-08-09 13:00:21+00:00,18,55,,
398,"Article published in May about Irish meat plants. Nothing done! Now the midlands outbreak and lockdown. 'Everyone's on top of you, sneezing and coughing': life inside Ireland's meat plants ",2020-08-09 12:55:07+00:00,46,82,,
399,"I always bought my hanging baskets ready & in blooming ol this year. During the early Covid-19 lockdown I wasn’t sure if garden centres would be open to buy them again, so I bought some seeds &amp; ordered some plug plants &amp; planted my own. I’m chuffed they have thrived! #gardening",2020-08-09 12:52:09+00:00,0,115,,#gardening
400,"Good job Lockdown Larry @GovLarryHogan https://www.fox5dc.com/news/maryland-murder-suspect-was-freed-due-to-covid-concerns-before-allegedly-stabbing-63-year-old-to-death While you illegally strip law abiding citizens of their rights, you release criminals to kill people.",2020-08-09 12:48:59+00:00,64,100,@GovLarryHogan,
401,We have witnessed the biggest moving of goalposts in history. A temporary ‘3 week’ lockdown to ‘protect the NHS’ has morphed into ‘We must accept a ‘New Normal’ of mandatory masks &amp; ‘social distancing’ &amp; change forever the way we live our lives’. Did we ever have a vote on this? ,2020-08-09 12:48:54+00:00,506,999,,
402,so I have never baked massive cakes until this lockdown.. ,2020-08-09 12:45:37+00:00,6,37,,
403,"There is a global awakening regardless of how the establishment media frames it, and it will be impossible to keep the lid on this for much longer. #Lockdown #Protest https://www.activistpost.com/2020/08/covering-up-the-awakening-massive-lockdown-protest-in-berlin-downplayed-and-demonized-by-msm.html?utm_term=Autofeed&amp;utm_campaign=Echobox&amp;utm_medium=Social&amp;utm_source=Twitter#Echobox=1596956856",2020-08-09 12:43:31+00:00,33,59,,#Lockdown #Protest
404,Atl needs to be put on lockdown for a minute. Too much going out. Too many out of Towners coming in for the wrong reasons. Too much bad energy. Were losing what made the city what it is.,2020-08-09 12:38:42+00:00,6,28,,
405,"Interesting that so early into the partial lockdown, politicians and public health officials are preparing people in Kildare, Laois and Offaly for the risk of it going on longer than 2 weeks.",2020-08-09 12:38:27+00:00,40,182,,
406,"Lockdown protests took place Saturday in London, Plymouth, Brighton,Norwich, Cardiff, Belfast, Southampton, Bristol, Liverpool, Newcastle, Birmingham, Nottingham, Leeds, Edinburgh, Glasgow, Aberdeen &amp; Manchester yesterday. They were organised by outfit called ""Save Our Rights UK"" ",2020-08-09 12:38:05+00:00,233,415,,
407,i miss the part of lockdown where i got to stay in a hotel for free every week cause of work ,2020-08-09 12:37:34+00:00,0,111,,
408,Finally tapos na yung lockdown!! Beach trip sino g? ,2020-08-09 12:36:18+00:00,13,819,,
409,"Great to see the West Cork @GardaTraffic Division taking a very proactive approach in preventing the spread of COVID-19 with overcrowded beaches, thus ensuring that rebel county doesn't slip backwards into a lockdown scenario again. @RepublicofPeter",2020-08-09 12:35:14+00:00,6,61,@GardaTraffic @RepublicofPeter,
410,The Lockdown Cookbook is now available to download! It features recipes from 4 Migrateful chefs and other amazing contributors such as @chukusLDN and @5oclockapron. 50% of profits will go to Migrateful and @TrussellTrust! Download a copy here: https://www.thelockdowncookbook.co.uk/purchase-the-cookbook,2020-08-09 12:35:04+00:00,11,21,@chukusLDN @5oclockapron @TrussellTrust,
411,"The mental health issues related to our lockdown and the pandemic are especially hard for people with depression. NAMI, The National Alliance on Mental Illness has a 24-hour helpline: 800-950-6264. ",2020-08-09 12:34:42+00:00,10,15,,
412,"I know lockdown made loads of people feel trapped, but for the first time in my life I was free from certain toxic relationships and it was incredibly liberating. I miss that.",2020-08-09 12:34:10+00:00,1,151,,
413,"If Sancho goes back to Dortmund and starts training tomorrow, his London trip is meaningless. However, it feels odd that they would allow him to go a party in London given that they fined him for having a lockdown haircut. If he doesn’t, maybe it’s close or he’s forcing a move.",2020-08-09 12:33:26+00:00,41,426,,
414,Your fed up fave is on BBC Scotland tonight where I’ll be continuing to question the recent actions of the SQA and their perceived attitude towards the working class. Navigating this under lockdown was no doubt tricky but I strongly feel it could have been handled better. ,2020-08-09 12:31:20+00:00,6,103,,
415,Now they are telling people in the 3 counties not to go on holiday even if its paid for. And no guarantee this lockdown will not be longer than 2 weeks.. Wake up..,2020-08-09 12:30:51+00:00,21,69,,
416," ""The silent COVID-19 death toll: Far more Australians will kill themselves because of coronavirus lockdown than those who die of the virus, experts say"" ",2020-08-09 12:26:11+00:00,33,64,,
417,Occasionally I see lockdown sceptics making some interesting points that ought to be listened to. And occasionally I see stuff like this. ,2020-08-09 12:23:30+00:00,10,44,,
418,"“Canada hasn’t needed heroic or draconian measures beyond an initial lockdown to get the pandemic under control. All it needed was a set of sensible rules — and, crucially, a consensus across political parties that the rules were there to be followed.” ",2020-08-09 12:21:40+00:00,1852,6414,,
419,"Covid-19-related racism: Muslims are being blamed for England's coronavirus outbreaks Lockdown was announced by UK govt in a slew of areas in northern England with significantly Muslim population, where cases have spiked just hours before Eid al-Adha. ",2020-08-09 12:20:23+00:00,33,52,,
420,"The Home Office spent more than a million pounds deporting hundreds of people at the height of lockdown, despite banning international travel. They deported a Polish woman who had lived here for 10 years, forcing her to leave her 11-year-old son behind. ",2020-08-09 12:18:47+00:00,262,174,,
421,Pep Lijnders: “I try to make each training session a masterpiece. Lockdown gave me time to prepare new sessions and to get new ideas.” ,2020-08-09 12:11:45+00:00,11,156,,
422,"Our beaches are packed today. Please stay away at this time, take care of yourself and of others. Our little island is extremely fragile right now. Economically & on a human level we dont want another lockdown. #WexfordTogether @aaroadwatch @rtenews @SouthEastRadio @beat102103",2020-08-09 12:10:16+00:00,69,174,@aaroadwatch @rtenews @SouthEastRadio @beat102103,#WexfordTogether
423,"Updated figure for illegal Channel arrivals since start of 2018 - 6,623 including over 4,000 since so-called 'lockdown' started. Monitor the Channel madness. Check our Tracking Station every day.... ",2020-08-09 12:09:09+00:00,56,64,,
424,Living together in lockdown... ,2020-08-09 12:08:25+00:00,13,578,,
425,Society has built up reserves of social capital which have been very badly eroded since lockdown. There is still palpable paranoia among many - thanks to govt fear campaign and BBC etc relentless panic news. They’re rending the fabric of communities more than CV.,2020-08-09 12:05:13+00:00,22,87,,
