,Text,Date,Retweets,Favorites,Mentions,HashTags
700,"Har occasion ko happy banado! Now in lockdown #celebrate your #birthday like never before! BTW delivers the same at all locations. Order the same, #eat the same, and #celebrate the same! We're available to order through #Zomato and #Swiggy. Order Now! https://www.zomato.com/ncr/restaurants/btw",2020-05-05 06:41:56+00:00,0,1,,#celebrate #birthday #eat #celebrate #Zomato #Swiggy
701,@Zomato @ZomatoIN I order grocery during lockdown bt my whole icream leaked from packet and damage all other product just becuse of hotness outside its very bad happen I just wanna want refund of my product,2020-05-05 06:55:36+00:00,0,0,@Zomato @ZomatoIN,
702,"@Zomato First You take orders and money and at time of delivery you cancel my order and delevery boy switch off his mobile , What a strategy in lockdown people are sleeping without food and you also earn without giving food ",2020-05-05 08:10:50+00:00,0,0,@Zomato,
703,"@ZomatoIN @Zomato First You take orders and money and at time of delivery you cancel my order and delevery boy switch off his mobile , What a strategy in lockdown people are sleeping without food and you also earn without giving food ",2020-05-05 08:12:19+00:00,0,0,@ZomatoIN @Zomato,
704,That's an awesome thought but after seeing the condition ystrdy I guess enforcing this at the moment wont be good..as people are already agitated and mentally in a bad shape coz of lockdown..total prohibition shoulnt be enforced as of now and it should be done one step at a time,2020-05-05 08:21:21+00:00,0,0,,
705,@swiggy_in and @ZomatoIN should really consider home delivery of liquor which might be a huge boost for y’all #lockdown,2020-05-05 10:21:08+00:00,0,0,@swiggy_in @ZomatoIN,#lockdown
706,@swiggy_in I place a order and it confirm but delivery boy told restaurant closed what the hell is going on during the lockdown when u don’t have proper knowledge that restaurant should open or not how can your company revived orders . ,2020-05-05 10:44:07+00:00,0,0,@swiggy_in,
707,"Late night gossips, Birthday pe GPL (Gaand Pe Laaath),Swiggy-Zomato 24×7,Akha Hostel apne baap ka waala feeling, Hostel Ka Khaana tatti (mutual agreement), Kuch hi din bache the yeh sabh enjoy krne ! Ghar baithne pr Hostel ki yaadh jyaada aa rhi h. Miss my Hostel Days. #lockdown ",2020-05-05 10:58:25+00:00,0,3,,#lockdown
708,Seriously! Govt could have done a proper planning before directly opening it for all.....swiggy etc could have been used for delieveries...total failure of the lockdown with 4000 cases and 190 deaths in single day...has govt forgotten about coronavirus and worried about revenues,2020-05-05 12:09:05+00:00,0,0,,
709,"Just a suggestion for all State governments, start alcohol sale through zomato and swiggy, so that people will not avoid social distancing, also add 70% covid tex on that like Delhi government and use this covid tex to increase covid test during lockdown, it will definitely help!",2020-05-05 12:20:35+00:00,0,1,,
710,"""Investors are bullish since the market for eating-in led by Swiggy turned into cooking-in almost overnight after a nationwide lockdown since March""",2020-05-05 12:29:32+00:00,0,1,,
711,"@PMOIndia please start home delivery of liquor. Use zomato , Swiggy etc. Please do not give away the advantage we gained in first 40 days of lockdown",2020-05-05 15:08:45+00:00,1,0,@PMOIndia,
712,"@narendramodi please start home delivery of liquor. Use zomato , Swiggy etc. Please do not give away the advantage we gained in first 40 days of lockdown",2020-05-05 15:23:18+00:00,0,0,@narendramodi,
713,You’re blessed when you can have a meal like this in these lockdown times. Ordered some of my favourites from #chinchinchujuhu today and boy was it fab! You can order through Zomato or Swiggy too. minakshichaudhri… https://www.instagram.com/p/B_z8j8xJQlH/?igshid=z1uokqouy301,2020-05-05 15:44:36+00:00,0,1,,#chinchinchujuhu
714,@zomatocare @Zomato @ZomatoIN Are you guys sourcing vegetables from farmers.I know a farmer who is stuck with a huge stock of red and yellow capsicum and unable to sell or transport due to the COVID-19 lockdown.can you please help or put me in touch with someone who can,2020-05-05 17:47:49+00:00,0,0,@zomatocare @Zomato @ZomatoIN,
715,"True that, Sir. As a temp bachelor staying away from family due to work &amp; the lockdown, finding the last 2 days really painful as no outlets are open after 7pm, though Swiggy &amp; Zomato are operational. How can these essential services serve us food if the kitchens are shut?.. SOS",2020-05-05 18:21:04+00:00,0,1,,
716,"Dear @swiggy_in @SwiggyCares V appreciate u guys helping us get stuff during these uncertain times. But be a lil considerate towards customers as well. Rs. 75 delivery charge 4 Rs. 146 worth delivery s too much. bear in mind tat due 2 d lockdown, v have also faced paycuts &amp; wt nt ",2020-05-06 01:28:22+00:00,0,0,@swiggy_in @SwiggyCares,
717,Swiggy during this lockdown period better to eat hygiene rather than taste... If ur dishes are tasty then it's a boon,2020-05-06 04:35:24+00:00,0,0,,
718,"@narendramodi @AmitShah @PMOIndia @himantabiswa The opening of liquor shops everywhere has totally defeated the purpose of lockdown..governments should allow only home delivery of liquor which can be done through the chains like Swiggy,Zomato,etc. for a limited period of time.",2020-05-06 05:04:49+00:00,0,0,@narendramodi @AmitShah @PMOIndia @himantabiswa,
719,A lot of brands are setting up dedicated stores on Swiggy &amp; Zomato. I am guessing this will continue once the lockdown is lifted. But wonder if these are viable in the long term. Probably a new model could evolve? @abezack,2020-05-06 07:09:31+00:00,0,4,@abezack,
720,Yummy fresh home made style phulka in the Indian Platter.Made with safety and love.Check out The ON Cafe on @Zomato! http://zoma.to/r/18662181 Swiggy https://lnkd.in/fS6Gsfc #theoncafe #onlynutrition #lockdown #zomato #swiggy #qurantine #orderonline #freshfood #takeaway #kolkata – at The On Café,2020-05-06 08:54:46+00:00,0,2,@Zomato,#theoncafe #onlynutrition #lockdown #zomato #swiggy #qurantine #orderonline #freshfood #takeaway #kolkata
721,"To reduce dependence on aggregators such as #Swiggy and #Zomato hit hard by the Chinese #WuhanCoronaVirus and the lockdown &amp; to grow in the future, different from the pre-coronavirus world the restaurants comes at a common loyalty programme, held in #Delhi by the NRAI on May 6",2020-05-06 11:26:50+00:00,0,0,,#Swiggy #Zomato #WuhanCoronaVirus #Delhi
722,"Anxiety and doubts mount during the #pandemic over the safety of eating home delivered #food, while corporates insist there's no cause for concern @Amitabhjoshi555 @Zomato @swiggy_in #hygiene #fooddelivery #lockdown #coronavirus",2020-05-06 12:34:25+00:00,3,4,@Amitabhjoshi555 @Zomato @swiggy_in,#pandemic #food #hygiene #fooddelivery #lockdown #coronavirus
723,Navane Mysorepak for sweet lovers If you want to start healthy sweets during lockdown we recommend you try. Place order on Zomato or SWIGGY Stay home stay safe. https://www.instagram.com/p/B_2PkUApAjo/?igshid=19o8a5qylugsi,2020-05-06 13:09:09+00:00,0,0,,
724,Also highly unprofessional @Paytm 1) I book 2 flight tickets which get cancelled due to Covid-19 lockdown But @PaytmTravel @PaytmTravelCare doesn’t bother to tell status of refund 2) I buy a travel pass but Zomato Promo Code doesn’t work @Paytmcare doesn’t care to solve it,2020-05-06 14:41:09+00:00,0,0,@Paytm @PaytmTravel @PaytmTravelCare @Paytmcare,
725,"Indian food delivery company Zomato aims to branch out into delivering alcohol, according to a document seen by Reuters, as it seeks to cash in on high demand for booze during the country’s coronavirus lockdown ",2020-05-06 14:51:07+00:00,49,75,,
726,"NEW DELHI Indian food delivery company @Zomato aims to branch out into delivering #alcohol, according to a document seen by @ReutersIndia, as it seeks to cash in on high demand for booze during the country’s #coronavirus lockdown. ",2020-05-06 15:04:03+00:00,1,1,@Zomato @ReutersIndia,#alcohol #coronavirus
727,"Indian food delivery company #Zomato aims to branch out into delivering alcohol, according to a document seen by Reuters, as it seeks to cash in on high demand for booze during the country's #coronavirus #lockdown. #liquor https://economictimes.indiatimes.com/small-biz/startups/newsbuzz/zomato-targets-push-into-alcohol-deliveries/articleshow/75580738.cms",2020-05-06 15:08:24+00:00,17,54,,#Zomato #coronavirus #lockdown #liquor
728,Good business opportunity...am sure Swiggy will also join in. Key issue is policy - center and states should allow this (and delivery of other 'non essentials')! This no e-commerce for 'non essentials' has been a wrong policy from day-1 of the lockdown. ,2020-05-06 15:14:43+00:00,2,39,,
729,Good business opportunity...am sure Swiggy will also join in. Key issue is policy - center and states should allow this (and delivery of other 'non essentials')! This no e-commerce for 'non essentials' has been a wrong policy from day-1 of the lockdown. https://m.economictimes.com/small-biz/startups/newsbuzz/zomato-targets-push-into-alcohol-deliveries/articleshow/75580738.cms,2020-05-06 15:14:43+00:00,2,39,,
730,"Indian food delivery company Zomato aims to branch out into delivering alcohol, according to a document seen by Reuters, as it seeks to cash in on high demand for booze during the country's coronavirus lockdown. #liquor ",2020-05-06 16:31:40+00:00,0,3,,#liquor
731,".@Zomato targets push into alcohol deliveries @EconomicTimes Zomato aims to branch out into delivering alcohol, according to a document seen by @Reuters, as it seeks to cash in on high demand for booze during the country's #coronavirus #lockdown #alcohol https://m.economictimes.com/small-biz/startups/newsbuzz/zomato-targets-push-into-alcohol-deliveries/articleshow/75580738.cms?utm_source=twitter_amp&amp;utm_medium=social&amp;utm_campaign=socialsharebuttons",2020-05-06 17:44:31+00:00,0,0,@Zomato @EconomicTimes @Reuters,#coronavirus #lockdown #alcohol
732,"Why dont the government just ally w Swiggy Zomato to deliver liquor all over? I mean it will save time, there won’t be rush, lockdown will be maintained. A proper win win",2020-05-06 20:38:54+00:00,0,0,,
733,"NEW DELHI: Food delivery company Zomato aims to branch out into delivering alcohol, according to a document seen by Reuters, as it seeks to cash in on high demand for booze during the country’s coronavirus lockdown. #alcoholdelivery #Alcoholhomedelivery #https://newsstore247.com/zomato-targets-push-into-alcohol-deliveries-report-times-of-india/",2020-05-06 22:42:25+00:00,0,0,,#alcoholdelivery #Alcoholhomedelivery
734,"Imagine going through lockdown at a time when there wasn't any broadband, Netflix, Amazon, Zoom, Whatsapp, Zomato etc etc. Now thank your stars #timing",2020-05-06 23:20:08+00:00,0,1,,#timing
735,@SwiggyCares @SwiggyCares @swiggy_in There Should Be A Special List Of Food Providers Nearby &amp; Their Menu During This Lockdown In Mumbai &amp; Whole India AS NOW A DAYS SITUATION CHANGES WILL HELP TO CHOOSE DO IT IF POSSIBLE KEEP IT UP SWIGGY WITH SAFETY FIRST AS PRIORITY.,2020-05-06 23:44:36+00:00,0,0,@SwiggyCares @SwiggyCares @swiggy_in,
736,@swiggy_in There Should Be A Special List Of Food Providers Nearby &amp; Their Menu During This Lockdown In Mumbai &amp; Whole India AS NOW A DAYS SITUATION CHANGES WILL HELP TO CHOOSE DO IT IF POSSIBLE KEEP IT UP SWIGGY WITH SAFETY FIRST AS PRIORITY.,2020-05-06 23:47:40+00:00,0,0,@swiggy_in,
737,"A better solution &amp; need of the hour. #LiquorShopsOpen #LiquorShops #Zomato to target #alcohol deliveries, aims to cash in on demand for liquor post-coronavirus lockdown: Report - Firstpost ",2020-05-07 02:44:31+00:00,0,1,,#LiquorShopsOpen #LiquorShops #Zomato #alcohol
738,"Sir I'm a Zomato delivery boy we are daily wage workers due to covid 19 Lockdown government has stopped our services but in our home there are problems with health anf finance ....every agent has this issue please give permission to our Zomato,@MinisterKTR",2020-05-07 02:56:22+00:00,0,0,@MinisterKTR,
739,"#coronavirusindia After grocery, Zomato may now deliver liquor for you amid lockdown, Mohit Gupta, Zomato’s CEO for food delivery, wrote in a business proposal to ISWAI: IE #CoronaVirus #Covid19 #pandemic #CoronaVirusUpdate #zomato #liquor #liquordelivery",2020-05-07 02:59:23+00:00,1,2,,#coronavirusindia #CoronaVirus #Covid19 #pandemic #CoronaVirusUpdate #zomato #liquor #liquordelivery
740,Swiggy’s new app feature to show partner restaurants' safety features in greater detail http://ow.ly/7D6M50zzfor @swiggy_in #marico #fooddelivery #foodtech #Restaurant #Apps #Safety #Lockdown #Covid19 @Shreyas_21,2020-05-07 03:45:04+00:00,0,3,@swiggy_in @Shreyas_21,#marico #fooddelivery #foodtech #Restaurant #Apps #Safety #Lockdown #Covid19
741,"Food delivery firm Zomato aims to branch out into delivering alcohol, according to a document seen by Reuters, as it seeks to cash in on high demand for booze during the coronavirus lockdown. ",2020-05-07 04:10:56+00:00,5,12,,
742,"Food delivery firm Zomato aims to branch out into delivering alcohol, according to a document seen by Reuters, as it seeks to cash in on high demand for booze during the coronavirus lockdown.",2020-05-07 04:11:32+00:00,5,10,,
743,"Indian food delivery company Zomato aims to branch out into delivering alcohol, according to a document seen by Reuters, as it seeks to cash in on high demand for booze during the country's coronavirus lockdown https://economictimes.indiatimes.com/small-biz/startups/newsbuzz/zomato-targets-push-into-alcohol-deliveries/articleshow/75580738.cms",2020-05-07 05:00:00+00:00,10,40,,
744,"Indian food delivery company Zomato aims to branch out into delivering alcohol, according to a document seen by Reuters, as it seeks to cash in on high demand for booze during the country's coronavirus lockdown. Ways the create jobs and jump start economy ",2020-05-07 05:10:04+00:00,1,0,,
745,"Indian food delivery company #Zomato aims to branch out into delivering alcohol, according to a document seen by #Reuters, as it seeks to cash in on high demand for booze during the country's coronavirus lockdown. #liquor #LiquorShops",2020-05-07 05:19:43+00:00,0,0,,#Zomato #Reuters #liquor #LiquorShops
746,"Under complete lockdown, Ahmedabad bans Swiggy, Zomato for a week https://www.medianama.com/2020/05/223-swiggy-zomato-banned-ahmedabad/",2020-05-07 06:34:55+00:00,1,1,,
747,"@ZomatoIN @Zomato you feed a hindu beef, and then dont aplogise or give my money or any compensation, exploiting the fact that i cannot file a case in lockdown. hope the police and courts agree to write my case. youll deserve the full force of the law",2020-05-07 06:40:59+00:00,0,0,@ZomatoIN @Zomato,
748,"And why not? Good for entire value chain Cashing in on Covid-19 lockdown, Zomato wants to deliver alcohol to you https://economictimes.indiatimes.com/small-biz/startups/newsbuzz/zomato-targets-push-into-alcohol-deliveries/articleshow/75580738.cms",2020-05-07 07:24:11+00:00,2,28,,
749,"@swiggy_in Lockdown has taught that having a hobby that can be pursued at home, is an absolute must. #SwiggyaHappyHeadlines",2020-05-07 08:32:21+00:00,0,0,@swiggy_in,#SwiggyaHappyHeadlines
750,"Got an opportunity to join swiggy to serve with essential needs where quality of customers actually values your efforts and wishes you for your growing goals in a few short words ""GOD BLESS YOU"" , it's more then anything in lockdown.TY#SwiggyHappyHeadlines @swiggy_in &amp; Nation IND",2020-05-07 08:41:45+00:00,0,1,@swiggy_in,
751,Zomato is just checking that how many customers did they lost in this lockdown .... True or not?? ,2020-05-07 10:48:48+00:00,0,0,,
752,"Under complete lockdown, Ahmedabad bans Swiggy, Zomato for a week https://www.medianama.com/2020/05/223-swiggy-zomato-banned-ahmedabad/ #Repost",2020-05-07 11:30:00+00:00,0,1,,#Repost
753,"@PMOIndia India me zomato, swiggy deliver boy allowed hai lockdown me but agar koi A.C ya Refrigerator mechanic aur auto rickshaw drive kamane nikle apne ghar se to galat hai, #MumbaiPolice #juhupolice",2020-05-07 11:57:17+00:00,0,0,@PMOIndia,#MumbaiPolice #juhupolice
754,"@swiggy_in horrible way of treating d customers in dis lockdown,had ordered some stuff some days ago, they sent me some other stuff ,never received the refund ,today widout delivering groceries there delivery boy went and marked as delivered my 1000 rupees gone for a toss again",2020-05-07 13:36:22+00:00,0,0,@swiggy_in,
755,@swiggy_in @SwiggyCares it's my first and last order in the lockdown with you. Your delivery guy confirm to delivery the order and while speaking to us cancel the order. What a service and we should bear the cost. Order no. 71931584612,2020-05-07 14:02:58+00:00,0,0,@swiggy_in @SwiggyCares,
756,#NATIONAL | Zomato seeks home delivery of alcohol amid lockdown: Report Zomato is mulling home delivery of alcohol according to a business proposal to International Spirits and Wines Association of India (ISWAI) by… https://www.instagram.com/p/B_46km7l5LF/?igshid=pfvz4st031n0,2020-05-07 14:03:25+00:00,0,0,,#NATIONAL
757,"Good on you @ZomatoIN. @swiggy_in @DunzoIt r u listening? Economic Times: Cashing in on Covid-19 lockdown, Zomato wants to deliver alcohol to you. https://economictimes.indiatimes.com/small-biz/startups/newsbuzz/zomato-targets-push-into-alcohol-deliveries/articleshow/75580738.cms via @GoogleNews",2020-05-07 14:45:36+00:00,0,0,@ZomatoIN @swiggy_in @DunzoIt @googlenews,
758,Will this happen? Can a lockdown catapult us into the obvious future earlier than we had expected? @Zomato @swiggy_in,2020-05-07 15:50:56+00:00,0,2,@Zomato @swiggy_in,
759,"@Zomato plans of delivering #alcohol amid #lockdown along with the groceries. Will @PMOIndia &amp; the government allow that to happen? Dunzo, an Indian #startup delivered alcohol previously but stopped due to restrictions. Will be interesting to see if #Zomato creates a milestone",2020-05-07 15:56:28+00:00,0,1,@Zomato @PMOIndia,#alcohol #lockdown #startup #Zomato
760,Thank you @swiggy_in @weareswiggy for this collaboration on composting &amp; gardening for swiggy employees during lockdown period . Great session partner @Compostwali . Lesson 2 Things required to grow Micro… https://www.instagram.com/p/B_5JY4Zp8es/?igshid=1lvqxkwo5k37e,2020-05-07 16:12:56+00:00,0,1,@swiggy_in @WeAreSwiggy @Compostwali,
761,Hamare yaha Zomato bhi band hai lockdown ka bad bhejta hu ,2020-05-07 17:40:44+00:00,0,0,,
762,"Under complete lockdown, Ahmedabad bans Zomato, Swiggy for a week https://www.medianama.com/2020/05/223-swiggy-zomato-banned-ahmedabad/ #Repost",2020-05-07 18:30:11+00:00,0,0,,#Repost
763,#Swiggy ordered fruits through app.Less quantity delivered.Provided no solution.Taking advantage of #lockdown,2020-05-07 20:52:32+00:00,0,0,,#Swiggy #lockdown
764,"Zomato aims to branch out into home delivering alcohol which is a wonderful step, But the real question here is 'How many of us are okay with half drunk liquor bottles?' #lockdown #delivery #liquor #LiquorShops #wineshops #beer #UtiliseLockdownWisely",2020-05-07 22:08:46+00:00,1,2,,#lockdown #delivery #liquor #LiquorShops #wineshops #beer #UtiliseLockdownWisely
765,"@ZomatoIN Hi , I have a coupon code given by Zomato and the coupon was expired on 16th April. During lockdown period services were down , I asked for expiry extn . On April 17th I raised concern to extend my expiry . And since now I have contacted 10 times . But didn’t get any.",2020-05-08 08:36:16+00:00,0,0,@ZomatoIN,
766,A #chocolatecake never saw an unhappy human being. — #premiumcake #luscious #blackforest #cakesandgrace #spreadlove #rohtak Order on #zomato #swiggy till #lockdown ,2020-05-08 09:02:17+00:00,1,4,,#chocolatecake #premiumcake #luscious #blackforest #cakesandgrace #spreadlove #rohtak #zomato #swiggy #lockdown
767,Do you have a defined criteria for winning? As this is going to be a long battle. I did not face any issues in lockdown. Is it that Swiggy was making less money. So withdrew service to charge more per order - as math might not be right. This would mean less orders. #swiggy #super,2020-05-08 09:30:14+00:00,0,0,,#swiggy #super
768,now zomato will home deliver liquior great pm modiji and all netas please suck more blood from poor ppl keep the lockdown till dec 2051....,2020-05-08 10:36:58+00:00,0,0,,
769,"How will businesses run if the safety declarations are not trusted? And for how long? I am aware this is a risk but eventually, it is this trust that will act as key factor for any business, once this lockdown is over/relaxed.",2020-05-08 12:55:28+00:00,0,3,,
770,A little token of respect and heartiest thanks to all the online services providing essential commodities at the doorstep which help a lot of families like us to manage the day to day needs without leaving home in the lockdown. #respect #lockdown @bigbasket_com @amazon @swiggy_in,2020-05-08 13:13:47+00:00,0,1,@bigbasket_com @amazon @swiggy_in,#respect #lockdown
771,"@bigbasket_com, it's been nearly two months since lockdown and your system is still broken, as evidenced by the sum total of yogurt and a couple sponges that arrived today from my large grocery order. Unreliable. Even Zomato delivers groceries better than you guys. Sheesh.",2020-05-08 13:54:22+00:00,0,0,@bigbasket_com,
772,It is very unfortunate that @Zomato taking advantages of ths lockdown and charging double the price.even the local shop is denying to give the food which is jst below my residence &amp; telling us to book it through @Zomato. A case need to be filed agnst such dirty marketing strategy,2020-05-08 14:57:23+00:00,0,0,@Zomato @Zomato,
773,I am not a delivery partner I am SWIGGY ODER MANAGEMENT TEAM (OMT)employer from Kolkata and company name is Kochar infotech who don't pay the full salary to the agent.for lockdown.@rahuljaimini @swiggy_in @SwiggyCares @nandanreddy @PMOIndia @harshamjty,2020-05-08 14:58:15+00:00,1,2,@rahuljaimini @swiggy_in @SwiggyCares @nandanreddy @PMOIndia @harshamjty,
774,"That moment when ur first order comes Haha ! Didn’t realize I will be so happy with our first delivery order , since lockdown ! @thehomemadecafe #thehomemadecafeandbar #juhu #homedelivery #kickstarts #ordernow Order from #Zomato &amp;amp; #swiggy ",2020-05-08 15:27:24+00:00,1,41,@thehomemadecafe,#thehomemadecafeandbar #juhu #homedelivery #kickstarts #ordernow #Zomato #swiggy
775,"That moment when ur first order comes Haha ! Didn’t realize I will be so happy with our first delivery order , since lockdown ! @thehomemadecafe #thehomemadecafeandbar #juhu #homedelivery #kickstarts #ordernow Order from #Zomato &amp; #swiggy",2020-05-08 15:27:24+00:00,1,41,@thehomemadecafe,#thehomemadecafeandbar #juhu #homedelivery #kickstarts #ordernow #Zomato #swiggy
776,I am not a delivery partner I am SWIGGY ODER MANAGEMENT TEAM (OMT)employer from Kolkata and company name is Kochar infotech who don't pay the full salary to the agent.for lockdown.@ndtv @ANI @PMOIndia @rashtrapatibhvn @ZeeNews @ABPNews @santoshgangwar @Calcutta_Times,2020-05-08 15:59:03+00:00,0,2,@ndtv @ANI @PMOIndia @rashtrapatibhvn @ZeeNews @ABPNews @santoshgangwar @Calcutta_Times,
777,This is how @Zomato delivers food during the lockdown. We ordered for the 1st time during this period but definitely a big mistake &amp; when called the customer care they are giving INR 225 coupons over a order of 900 Please do not order from Zomato no care taken during Covid-19 ,2020-05-08 16:35:51+00:00,0,1,@Zomato,
778,"In this #COVID19 Special Series episode, Sindhu Kumar, a Manager at @swiggy_in Swiggy, speaks about the challenges involved in managing deliveries for customers during the pandemic and #lockdown. #Gigworkers #FoodDelivery #Swiggy https://soundcloud.com/radioactivecr90-4mhz/ra-covid-19-special-with-swiggy-fleet-manager-sidhu-kumar-businesses-and-lockdown-rj-usha",2020-05-08 16:45:07+00:00,0,0,@swiggy_in,#COVID19 #lockdown #Gigworkers #FoodDelivery #Swiggy
779,"Hi shreya, Applogize won't feed our stomach, for your delayed service my friend wnet with an empty stomach. Ok in this lockdown may ne there would be delay. But what abt the food quality? A dry dosa with a very low quality and quantity. PFB @SwiggyCares @swiggy_in @nandanreddy https://twitter.com/SwiggyCares/status/1258993704192204800",2020-05-09 06:17:51+00:00,0,0,@SwiggyCares @swiggy_in @nandanreddy,
780,What is going on @dominos_india @dominos ? You’re advertising as Domino’s safe delivery &amp; this is what happening in ur outlet at ground level. Plz #SayNoToDominos during lockdown @UfterYou @MoHFW_INDIA @fssaiindia Plz remove dominos as ur partner @ZomatoIN @swiggy_in,2020-05-09 06:19:38+00:00,0,1,@dominos_india @dominos @UfterYou @MoHFW_INDIA @fssaiindia @ZomatoIN @swiggy_in,#SayNoToDominos
781,Lit bit of good news for the hood -Neighbourhood Nathu’s is now open to deliver-via @Zomato &amp; @swiggy_in too -so pls show them a bit of love -especially if u have been craving the chaat and cholas #lockdown #LOCKDOWNDIARIES,2020-05-09 10:01:57+00:00,0,8,@Zomato @swiggy_in,#lockdown #LOCKDOWNDIARIES
782,Okay I'm exhausted now. Ordering @swiggy_in in lockdown is fine but the way i have been treated is bad! Ordered @kfc and the chicken was stale/black. I complained &amp; It's been 4 days no help from @SwiggyCares till now. Disgusting resolution!! @ArvindKejriwal @fooddeptgoi Help plz!,2020-05-09 10:04:10+00:00,0,0,@swiggy_in @kfc @SwiggyCares @ArvindKejriwal @fooddeptgoi,
783,Day 5 Follow up Shame on you @swiggy_in @SwiggyCares get a life you useless....this is what I want to put on you.... But I'm following up you so I can't say that now...#carryminati #HBDVijayDeverakonda #Covid_19 #fooddelivery #youtubevstiktok #lockdown #tiktokers,2020-05-09 10:22:40+00:00,3,1,@swiggy_in @SwiggyCares,#carryminati #HBDVijayDeverakonda #Covid_19 #fooddelivery #youtubevstiktok #lockdown #tiktokers
