,Text,Date,Retweets,Favorites,Mentions,HashTags
955,Let The Red Velvet Hotel's restaurant come to you! The kitchen of Ambrosia is now serving at your address with all safety measures. Place your order online on Zomato/Swiggy. #theredvelvethotel #homedelivery #onlineorder #fooddelivery #lockdown #zomato #swiggy #stayhome #patna,2020-05-22 09:50:27+00:00,0,0,,#theredvelvethotel #homedelivery #onlineorder #fooddelivery #lockdown #zomato #swiggy #stayhome #stayhome #patna
956,"We are entering into a new world and Kesariya's is equipped for it. Sanitised and clean, we are back to serve you. Order your favourite sweets from Kesariya's through Zomato or Swiggy. Visit our website: http://kesariyassweets.in/ #Kesariyas #Sweets #Lockdown #stayhome #Hyderabad",2020-05-22 11:56:17+00:00,0,0,,#Kesariyas #Sweets #Lockdown #stayhome #stayhome #Hyderabad
957,@swiggy_in I understand that you want to make money after the lockdown but charging almost 1.5 times the actual cost the restaurant charges + delivery is not done. Its not like we don't know the cost of the items we regularly buy. Bad and sad.,2020-05-22 12:16:10+00:00,0,0,@swiggy_in,
958,"Happy News: Corona Lockdown eased Swiggy, Zomato to home-delivery Alcohol - Will start with Bangalore City first. Swiggy said it was in advanced talks with multiple states to launch the service in more locations. #liquorshops #HomeDeliveryOfLiquor #SwiggyAlcoholDelivery",2020-05-22 13:03:16+00:00,0,1,,#liquorshops #HomeDeliveryOfLiquor #SwiggyAlcoholDelivery
959,"@ZomatoIN @Zomato During lockdown delivery boys are helping out our hunger but But we are not satisfied with the food we order We get spoiled food like Fungus in the sweets , Rice stored in frozen for a week and getting smell Packing issues &amp; Many more",2020-05-22 16:25:12+00:00,1,1,@ZomatoIN @Zomato,
960,"What about Indian ecom market? I'm a regular online shopper, but not able to shop anything online in last 60 days (location: Pune) except few grocery recently that too from zomato. It was much needed in lockdown, especially semi essentials like peripherals, mobile accessories etc",2020-05-22 16:45:14+00:00,0,0,,
961,"Would the students of WhatsApp university and the media professors, with bellies full of scotch and Swiggy delivered delicacies, hardly a dent in the bank balance, clamour for another lockdown extension as the number of “cases” is rising?",2020-05-23 04:33:17+00:00,0,0,,
962,We will love to thanks @swiggy_in and @ZomatoIN to deliver foods at this pandemic with risk for us. . They are also COVID heroes for us. . Thanks to not make quarantine days boring in India. #Truptee #Lockdown #Covid19 #Order #Swiggy #Zomato #Bhubaneswar,2020-05-23 06:23:17+00:00,0,1,@swiggy_in @ZomatoIN,#Truptee #Lockdown #Covid19 #Order #Swiggy #Zomato #Bhubaneswar
963,"This happens every time now a days, whenever I order something, it takes more time than usual and the only reason ur help executive has is lockdown and less availability of staff",2020-05-23 07:59:25+00:00,0,0,,
964,Great News for #MeatLovers! #BombayMeatCo is live on #Zomato! Now get fresh meat quicker than ever. #FoodDelivery #MeatDelivery #MeatLovers #HalalMeat #Chicken #Mutton #Seafood #Fish #Poultry #Lamb #Quarantine #Lockdown #Mumbai #chemicalfree #lockdowncooking #quarantinecooking,2020-05-23 09:17:58+00:00,0,1,,#MeatLovers #BombayMeatCo #Zomato #FoodDelivery #MeatDelivery #MeatLovers #HalalMeat #Chicken #Mutton #Seafood #Fish #Poultry #Lamb #Quarantine #Lockdown #Mumbai #chemicalfree #lockdowncooking #quarantinecooking
965,Zomato looking at other means to make money amid lockdown and i’m a gold cust. Mix up orders - send single use coupon (not refund) - lie that it can be used anywhere -later say sorry we had no idea and harass customers @zomatocare @ZomatoIN @consumerforum_ @Zomato @ZomatoGold ,2020-05-23 14:13:46+00:00,0,3,@zomatocare @ZomatoIN @consumerforum_ @Zomato,
966,Missing badly late night @swiggy_in and @ZomatoIN food delivery #COVIDー19 #Ahmedabad #lockdown,2020-05-23 18:20:08+00:00,0,1,@swiggy_in @ZomatoIN,#COVID #Ahmedabad #lockdown
967,"@CMPuducherry @thekiranbedi Permission for liquor sale in Pondy when the UT has started showing increase in no. of case in lockdown 4.0 is a bad idea. Taxes are important not at cost of health. Would urge to consider online delivery via swiggy, zomato etc.",2020-05-23 18:22:13+00:00,0,0,@CMPuducherry @thekiranbedi,
968,@nitingokhale INDIA has a CLEAR message for Chinese in #Ladakh Pangong Lake Since #COVIDー19 #Lockdown it can be clearly seen from Beijing too See if you can find it! We love Chinese! In fact we sell Chinese on every nook &amp; corner of India. Just ask @Zomato or @swiggy_in,2020-05-23 21:46:14+00:00,2,12,@nitingokhale @Zomato @swiggy_in,#Ladakh #COVID #Lockdown
969,Thanks @SidShirole ....this is a good news. My family was regular visiting Shabree before lockdown. Time to order online now,2020-05-24 02:05:33+00:00,0,1,@SidShirole,
970,"@Olacabs @swiggy_in @Zomato @oyorooms @Uber Is this true ? Are we saying we are running into cashflow issue due to 60 days of lockdown? Or we want to spend only from what we earn ? Just think , keeping humanity into consideration. Hope u have heard of GOOD PROFITS &amp; BAD PROFITS ",2020-05-24 05:15:42+00:00,0,0,@Olacabs @swiggy_in @Zomato @oyorooms @Uber,
971,"@Zomato started its loot just after lockdown is relaxed, an update was pushed yesterday and now can see a distance fee got added. Even the delivery charge is increased. Last week ordered same item for around 24Rs lesser. #zomato #food #loot",2020-05-24 06:19:54+00:00,0,1,@Zomato,#zomato #food #loot
972,"Dear @swiggy_in @SwiggyCares, Thank you for providing rotten veggies in middle of the lockdown. It's like as good as not having anything to eat even after spending money. A big thanks.! ",2020-05-24 06:43:02+00:00,1,0,@swiggy_in @SwiggyCares,
973,"@swiggy_in @SwiggyCares @ndtv I had purchased a swiggy Super subscription on Feb 14 and which was valid till May 14. Due 2 d lockdown, most of d period fell under it and in #Hyderabad there was a ban on restaurant ordering, the amt shld hav been refunded or subscription extended ",2020-05-24 08:30:17+00:00,0,0,@swiggy_in @SwiggyCares @ndtv,#Hyderabad
974,"I am not saying here for a new subscription, but it's not ethical for people to being charged when the service was not provided by whatever means . Zomato extended my gold subscription since there was a lockdown, why nt swiggy ? The amt may bmeagre but it's abt customer service",2020-05-24 08:35:31+00:00,0,0,,
975,Sir ground level sa bata raha hu pehla sa kam jarur hua hai bahar ka khana but abhi lockdown jab sa ease hua mera shop ka pass hi dominos hai and ek other restaurant hai jaha pa Zomato and swiggy kafi sahi order ja raha hai...log abhi lightly hi la Raha hai...,2020-05-24 13:35:55+00:00,0,1,,
976,My @dominos_india order via @swiggy_in is being baked since 1 and half hour. No way to cancel this order and they don't even pick-up the phone. I know it's a lockdown but why accept the order of you can't deliver. ,2020-05-24 15:37:52+00:00,0,0,@dominos_india @swiggy_in,
977,That's the biggest problem in India. Little bit of freedom and they think they have got everything. Shame on such people. What is the government doing about it. The whole lockdown is a big humbug having put the country in shambles.,2020-05-24 16:48:48+00:00,0,0,,
978,This is how Swiggy plays games with the customers during lockdown. I know the situation is hard but they are just taking this as an excuse and advantage to loot the customers then and there!!! @swiggy_in @SwiggyCares @WeAreSwiggy @SwiggyTech,2020-05-24 20:04:16+00:00,2,1,@swiggy_in @SwiggyCares @WeAreSwiggy @SwiggyTech,
979,Helo sir good morning main ek swiggy delivery boy hon sir sir mera baike kharab hogaya hai sir lockdown me aap se muhje help chaiye sir ,2020-05-25 01:52:45+00:00,0,0,,
980,@swiggy_in wo bad swiggy id providing pathetic service during this lockdown crisis and not even compensating someone's hard-earned money.... No solution ,2020-05-25 07:02:50+00:00,0,0,@swiggy_in,
981,What essential services is @ncbn providing? Is he a swiggy/Zomato/medicine delivery boy ..?? He should be arrested immediately for breaking lockdown guidelines and for taking off a political rally. #ChandrababuSpreadsCorona,2020-05-25 10:39:55+00:00,18,7,@ncbn,#ChandrababuSpreadsCorona
982,Please help by donating to 'Feed the Daily Wager' by Zomato Feeding India ( @FeedingIndia ) and provide food support to daily wagers who lost their livelihood due to COVID-19 lockdown. Click to donate – ,2020-05-25 14:01:28+00:00,0,0,@FeedingIndia,
983,.@swiggy_in and @Zomato delivery people are struggling to eke out a living during the #COVID19 pandemic and #lockdown. ,2020-05-25 14:46:17+00:00,0,0,@swiggy_in @Zomato,#COVID19 #lockdown
984,Zomato is fooling us my registed mobile number was changed earlier and it’s showing in my app also and he is lying me to deliver my order as i have paid it online. Bad service in this lockdown #zomato,2020-05-25 15:39:42+00:00,0,0,,#zomato
985,@Zomato Zomato is fooling us my registed mobile number was changed earlier and it’s showing in my app also and he is lying me to deliver my order as i have paid it online. Bad service in this lockdown Please zomato se dur raho ,2020-05-25 15:40:35+00:00,0,0,@Zomato,
986,Would you stop lying that the restaurant is closed and all that crap just because you are not able to figure out a resolution....If my nearby restaurant is closed till lockdown then how come swiggy is delivering your orders in my area?? R they making your biryani themselves? ,2020-05-25 16:31:39+00:00,0,0,,
987,"What's happening with @swiggy_in and @dominos ?? Had a bad personal experience. Wifey ordered pizza, made the payment, but the food never arrived. Tracking the order shows ""delivered"". Lockdown blues? Hope not many people are experiencing the same.",2020-05-25 16:35:55+00:00,1,2,@swiggy_in @dominos,
988,"@ZomatoIN @Zomato Dear Zomato as u guys r allowed to do delivery in this lockdown and instead of doing the service effectively u guys have started a loot by charging customers under “Taxes n Charges” not 20,30 but 100rs.plz do nt tk ths situation as opportunity of making money ",2020-05-25 17:13:37+00:00,0,0,@ZomatoIN @Zomato,
989,I m nt a new user on zomato so pls dnt try to explain me wht I already know.. the thing is these charges r spiked in the lockdown and i can go into my history of order n let u know... u guys are seeking an opportunity to cease such charges frm innocent ppal,2020-05-25 17:29:14+00:00,0,0,,
990,"@SwiggyCares,@swiggy_in Good morning sir, Mai Hemant kumar mishra ,id 558044 Mai swiggy me kam krta hu but meri id block kr di gai h achanak Is lockdown me bahut problem ho rhi h plz help me sir ",2020-05-26 03:51:47+00:00,0,0,@SwiggyCares @swiggy_in,
991,#Bengaluru was caught by surprise with a sudden downpour on Sunday. A #swiggy delivery staff braves the rain and continues his duties. These delivery staff have been working very hard through lockdown. @santwana99 @XpressBengaluru #CovidWarriors #COVID__19 #lockdownindia,2020-05-26 05:17:10+00:00,12,115,@santwana99 @XpressBengaluru,#Bengaluru #swiggy #CovidWarriors #COVID__19 #lockdownindia
992, STARTUP LAYOFFS Startups are facing a 75-90% drop in their revenues due to the lockdown. Uber has laid of 600 employees among others. #Uber 600 #Ola 1400 #Swiggy 1100 #Zomato 500 #ShareChat 100 #WeWork 100 #Paytm 500 #Oyo 2400 #CarDekho 200 #CureFit 1000,2020-05-26 05:29:29+00:00,8,34,,#Uber #Ola #Swiggy #Zomato #ShareChat #WeWork #Paytm #Oyo #CarDekho #CureFit
993,Thank u Zomato for service in #Bengaluru #lockdown. I ordered #food twice a day and it was always prompt @Zomato @ZomatoIN @zomatocare,2020-05-26 07:37:56+00:00,0,0,@Zomato @ZomatoIN @zomatocare,#Bengaluru #lockdown #food
994,"@Zomato @ZomatoIN @zomatocare Luckily I met another delivery guy a moment ago, asked him if there were any restrictions while delivering in my area and he said none since lockdown 4 started which means Gaurav (rider) was lying. Strict action should be taken against him.",2020-05-26 07:50:06+00:00,0,0,@Zomato @ZomatoIN @zomatocare,
995,"Burgers are the best gift after #Lockdown, Order Hello Burger's rich, smoky hot range of burgers and spread happiness to your loved ones! Call Now : +91-9870400830 https://buff.ly/2A5q4Wn #burgers #Swiggy #Zomato #BurgerPlaceAtDelhi #SpicySnacksPlace #SpicyBurgerWithDrink",2020-05-26 08:50:34+00:00,0,2,,#Lockdown #burgers #Swiggy #Zomato #BurgerPlaceAtDelhi #SpicySnacksPlace #SpicyBurgerWithDrink
996,"More than 3,000 people have lost their jobs at Indian tech unicorns in one just week during lockdown series 4.0. These numbers are from few famous companies like Ola, Uber, Swaggy, Zomato, Amazon etc. Millions of people had slready lost their jobs in India which is not accounted",2020-05-26 10:46:37+00:00,0,0,,
997,guess what swiggy and Myntra both eCommerce companies refunded my cash today for a cancellation I did today. I wonder how they're doing it in this lockdown. Perhaps you can take some tips from them.,2020-05-26 11:42:18+00:00,1,4,,
998,"We know how hard it is to satisfy your cravings during this lockdown. Worry not, we deliver your favourite food to your home! Order online on Swiggy or Call- 9049724009, 9623445046, 8806363050⠀ . . . #Nasiklub #Nashik #NashikRoad #HomeDelivery #NashikRestaurants #NashikFoodies",2020-05-27 04:30:07+00:00,0,3,,#Nasiklub #Nashik #NashikRoad #HomeDelivery #NashikRestaurants #NashikFoodies
999,"@swiggy_in since when you have started cheating people..or just developed a new way to earn money during lockdown? Modus operandi Accept delivery - &gt; receive payment -&gt; cancel it on your own -&gt; don't refund.. wow These online sites, all are cheaters..",2020-05-27 04:33:32+00:00,0,0,@swiggy_in,
1000,Of course. I just suggested a stop gap arrangement. Should have been something he could have tried since the lockdown. Great If he is planning something better now ,2020-05-27 08:48:06+00:00,0,1,,
1001,"EXCLUSIVE | .@Swiggy_in is rustling up a new offer to win over restaurants hit hard by the #lockdown and also plug the supply chain gap left by #COVID19 disruptions, @PratikBhakta_89 reports. #Swiggy #COVIDImpact",2020-05-27 08:50:13+00:00,0,5,@swiggy_in @PratikBhakta_89,#lockdown #COVID19 #Swiggy #COVIDImpact
1002,"During lockdown, most of the start ups are now acquiring a 2 wheeler fleet and jumping into the delivery space. Swiggy shifted focus to its Genie pilot and launched it nationally. Zomato &amp; http://Eat.Fit are doing grocery delivery. Amazon started food delivery. Now Uber:",2020-05-27 09:50:32+00:00,0,2,,
1003,"@Zomato @ZomatoIN @zomatocare team are uh guys working or just lockdown in ur homes , such a dissatisfactory service, never expected this from ur team , valet denied to put my food out my entrance gate!!! worst experience,",2020-05-27 10:24:49+00:00,0,0,@Zomato @ZomatoIN @zomatocare,
1004,Swiggy &amp; Dunzo have been our uncelebrated lifelines through this lockdown. Hope their staff are safe and cared for. ,2020-05-28 02:21:26+00:00,0,3,,
1005,True the Yes NO by govt. on allowing home delivery for zomato has been hurting also no body thinking of shaadi under lockdown ,2020-05-28 11:33:42+00:00,0,1,,
1006,It means a lot a reply from you . Because iam also a delivery partner of swiggy In Hyderabad Manikonda area so as Of know because of lockdown we are home so want to start the work now cant be at home more as of finanicial problem at home and my id is also temporary block ,2020-05-28 12:51:41+00:00,0,0,,
1007,@SwiggyCares It means a lot a reply from you . Iam also a delivery partner of swiggy In Hyderabad area so as Of know because of lockdown we are at home so want to start the work now cant be at home more as of finanicial problem at home and my id is also temporary block ,2020-05-28 13:22:19+00:00,0,1,@SwiggyCares,
1008,"@swiggy_in but at least increase good hygeinic restaurants in times of lockdown!If hygeine maintained restaurants delivery takes extra charge also it cn b beared bt atleast in times of Corona,delivery boys shall deliver 4m anywhere in Kolkata vicinity! Because criteria is hygeine",2020-05-28 14:36:53+00:00,0,0,@swiggy_in,
1009,More than 50% of resturant listed on #Swiggy has worse condition than this. No guidelines for hygiene from @swiggy_in @SwiggyCares thanks to lockdown now people at started ordering less from them. ,2020-05-28 16:31:24+00:00,0,1,@swiggy_in @SwiggyCares,#Swiggy
1010,Well there goes your 'lockdown is causing a decrease' argument,2020-05-28 17:56:11+00:00,0,0,,
1011,@swiggy_in i have a serious issue where the food is not delivered and i have been charged money. @ArvindKejriwal @journosaurav boss amidst this lockdown everybody is enjoying as they know that tha cases cannot be filed in any of the courts. Really sorry swiggy and all the online,2020-05-28 18:06:26+00:00,0,0,@swiggy_in @ArvindKejriwal @journosaurav,
1012,Dnt u feel shame chor zomato disable ther insurance bc lockdown they cnt able to work .,2020-05-28 20:57:03+00:00,0,0,,
1013,@SwiggyCares @swiggy_in it's really shame on you guys for charging Rs. 49/- extra than the actual bill How can you loot money even during this lockdown? Have some principles while doing business. @Zomato @ZomatoIN is far better than you guys,2020-05-29 02:34:42+00:00,0,0,@SwiggyCares @swiggy_in @Zomato @ZomatoIN,
1014,Online food delivery orders still down 60% in May from pre-Covid levels in March First week of lockdown orders fell 90% from 2.5-3 mn a day peak in early March between Swiggy &amp; Zomato Grocery now accounts for 15% of Zomato orders @digbijaymishra1 http://toi.in/Bpwiwb59/a24gj,2020-05-29 04:36:52+00:00,3,10,@digbijaymishra1,
1015,During lockdown swiggy zomato fails But wife never fails Living happy life is what matters to me I have decided Village girl,2020-05-29 08:41:25+00:00,0,0,,
1016,@Zomato I am a pharmacist and we have been working since the day lockdown was implemented but we never demand tips. I feel in name of your drivers it’s your organisation which is behind making the money. This sucks when u know ppl are financially shaken up u want a tip ,2020-05-29 09:21:39+00:00,0,0,@Zomato,
1017,"ITC Hotels partners with Swiggy to home deliver ‘fine dining' Coronavirus and lockdown has thrown up things unimaginable. @ITCHotels , a 'Responsible Luxury' pioneer to have its fabled food home delivered through @swiggy_in",2020-05-29 13:07:10+00:00,0,0,@ITCHotels @swiggy_in,
1018,Sar me ek Zomato ka rider hun jisne pure lockdown mein pahle din se a hi hi field per Apne aur apne family ko risk mein rakh kar kaam Kiya hai fir bhi company ne Mera rate card change kar diya Bina inform ke please please meri help Karen main bahut tension mein hun,2020-05-29 14:11:27+00:00,0,0,,
1019,Yes with the delivery charges and distance fees that wasn't around before we are making sure Swiggy and Zomato survive the lockdown.,2020-05-29 14:34:58+00:00,0,1,,
1020,@harshamjty what the hell is happening with swiggy because of lockdown loss. Are you trying to loot people money.,2020-05-30 05:44:36+00:00,0,0,@harshamjty,
1021,"order revice form masalastreetindia in this lockdown good food provide and tasty food with safty i loved, you must be order from zomato i hope you also liked food . locaction : masalastreetindia . follow me aslo… https://www.instagram.com/p/CAzf8esFtbU/?igshid=vvrve55p6c7c",2020-05-30 08:06:53+00:00,0,0,,
1022,Looks great. Thanks for sharing. Checked out the menu. What a good selection of items. I don't know how I missed this place. I order so much from Zomato. Have done throughout lockdown.,2020-05-30 09:02:08+00:00,1,1,,
1023,@ZomatoIN @Zomato @swiggy_in U guys need to start a plan..where customer can give advance to their favourite restaurants to tide through these tough times and in return when lockdown ends..customer can order using that amount plus some additional discounts..win win solution,2020-05-30 10:22:41+00:00,0,0,@ZomatoIN @Zomato @swiggy_in,
1024,"This is absolute robbery, in broad daylight! Sounds like @swiggy_in &amp; @BiryaniBlues are too desperate to make up for the business lost during lockdown, by hook or crook. Not gonna work!",2020-05-30 14:20:20+00:00,1,1,@swiggy_in @BiryaniBlues,
1025,"I have a reasearch done on this. All those belonging to Zomato gold have much taxes. 30 rs additional charges along with taxes are applied. Further, each and every order of mine during the lockdown has taken more than 1.5 hours to reach me",2020-05-30 15:42:24+00:00,0,0,,
1026,Wow... Nice way to serve #Customers during #lockdown #Swiggy's new #CustomerService at its best.,2020-05-30 16:35:59+00:00,0,0,,#Customers #lockdown #Swiggy #CustomerService
1027,@swiggy_in @SwiggyCares @SwiggyTech @swiggydesign Please bring back the good old Demand feature in DE App. After the update we aren't able to see demand areas &amp; we don't know where to go. It's a bit frustrating. Please understand our situation in this lockdown and do the needful ,2020-05-30 17:06:16+00:00,0,0,@swiggy_in @SwiggyCares @SwiggyTech @swiggydesign,
1028,"@Zomato are u people enjoying for not giving my refund from last 4 days, i dint received my food and now m struggling for my refund.... Good going, have a gr8 business in this lockdown",2020-05-30 18:21:24+00:00,0,0,@Zomato,
1029,"@Zomato wtf during this lockdown we can expect a quality and good food from you but you disappointed my hopes, uncooked food, and rotten food delivered to me. It was my mistake I should have to gone with @swiggy_in",2020-05-30 19:39:39+00:00,0,1,@Zomato @swiggy_in,
1030,@Zomato @deepigoyal it’s really good that you have taken an initiative to provide the real experience to the customer by decreasing the rating of all the outlets. Specially at this time when the whole country is in lockdown.but while doing this .@Zomato made the mistakes.,2020-05-30 19:49:21+00:00,0,0,@Zomato @deepigoyal @Zomato,
1031,Having trouble finding a good baker to customise cakes during the lockdown? Drop us a message or call us @8754297315. Cakes could be picked contactless at our premises in Anna Nagar as well as thru Swiggy Genie. https://www.facebook.com/PrishasCustomBakes/ https://www.instagram.com/prishas_custom_bakes,2020-05-31 05:35:00+00:00,0,0,,
1032,A shout out to @swiggy_in groceries .. way better than @bigbasket (which still haven’t been able to provide slots since the lockdown). It takes multiple orders but I get everything I need and I don’t mind paying for this service . I would suggest they increase stores next,2020-05-31 09:51:39+00:00,0,1,@swiggy_in @bigbasket,
1033,"Is it the quality of items delivered or the availability? Becoz in Gurugram/Delhi @bigbasket_com nd @Grofers are doing a fantastic job since the lockdown, barring few hiccups. Maybe it depends on the city nd demand situation, availability of manpower etc. we shud applaud all ",2020-05-31 11:13:14+00:00,0,0,@bigbasket_com @Grofers,
1034,"@swiggy_in @SwiggyCares I really appreciate swiggy working along with all the employees during the lockdown and serving us good food as always. So no complaints but just a suggestion, I see that probability to get wrong food items is higher by Gopalas than the other restaurants.",2020-05-31 11:19:57+00:00,0,0,@swiggy_in @SwiggyCares,
1035,"Yeah we are fine. I havent been out at all, its been Amazon and Swiggy which has helped us a lot by delivering stuffs. We just go to the nearby shop once in 2 weeks if we need anything urgently otherwise we try ordering online. Lets all hope this lockdown will reduce cases",2020-05-31 12:04:17+00:00,0,0,,
1036,I am from Mumbai too and big basket made my life easy throughout the lockdown. It has infact earned me back as a customer. I used to be a Grofers loyalist.,2020-05-31 13:37:10+00:00,0,0,,
1037,Now I understand why my mom used to give me a task to peel garlic when I was a kid. Annoying bacho ke liye annoying task. It is such an annoying thing to do. Acha badla lia mummy ne. @ZomatoIN @swiggy_in #KhaanaKhazana #Quarantine #Lockdown #Food,2020-05-31 15:14:34+00:00,0,0,@ZomatoIN @swiggy_in,#KhaanaKhazana #Quarantine #Lockdown #Food
1038,"I recharged my Paytm few days ago, even that will go now after I finish the money. Zomato, swiggy etc already junk in lockdown.. I started from Big basket actually.. Nasty ""Chin***"" people",2020-06-01 01:09:07+00:00,0,1,,
1039,We're ecstatic to announce that Rustom's is now open daily for deliveries all across Delhi from 12-10pm. You can view our limited lockdown menu on our feed and story highlights and place your orders directly by calling us on 9910060502. Online orders on Zomato and Swiggy. ,2020-06-01 08:16:20+00:00,1,2,,
1040,@ZomatoIN @Zomato i am yet to receive a resolution from u guys...this is ugly from u people...purely disgusting...shame on ur people...u are scamming people in the current situation of lockdown...its just pure shame...disgusting ,2020-06-01 09:31:39+00:00,0,0,@ZomatoIN @Zomato,
1041,"#Opening #Nashik #1stLaunch #PostLockdown 1st Store Launch Post Lockdown. NasHIk, you can now Relish everyone's favorite Apsara Ice Creams . Enjoy the scrumptious with the best safety measures. Order Online : Swiggy, Zomato From our Store to your Tummy. Safe and Yummy! ",2020-06-01 13:49:03+00:00,1,1,,#Opening #Nashik #1stLaunch #PostLockdown
1042,"Nobody denies that even @Swiggy consumers, isn't it against FDI rulebook?Since when did it became a retail store?or was it only for lockdown? What about the pricing, undue advantage of pandemic by reducing margins of small retailers and stopping the bonuses too",2020-06-01 13:52:08+00:00,1,1,@swiggy,
1043,"This is the service that @swiggy_in provides during lockdown, no resolution in chat or call. Btw this mess is called a pizza @Oven_Story . All they post on social media is how good they are in customer service. They are wasting good ingredients. #badservice",2020-06-01 21:12:57+00:00,0,1,@swiggy_in @Oven_Story,#badservice
